movie_name,comment_type,comment_text,rating,votes_count,created_at,comment_length,source_page
飞驰人生3,1,目前系列最佳，非常纯粹的赛车电影。文戏精炼克制，讽刺意味却丝毫未减。赛车戏占比大幅提高，镜头很帅，全程高燃，还加入了人与AI的对抗。结尾也不拖沓，没有那种很尬的煽情，张驰已经不需要自我和解了，他和观众需要的都只是“享受比赛”。,5,4558,2026-02-17 12:10:51,113,1
飞驰人生3,1,韩寒写了部真正的中国侠客故事，事了拂衣去，干干净净赢。,4,4214,2026-02-17 11:11:34,27,1
飞驰人生3,1,这次赛车戏量大管饱，三部之最，且在前两部的基础上做了升级，作为洲际比赛的沐尘100拉力赛，比巴音布鲁克难度更高，柏油路→砂石路→川西组合弯→戈壁等连续的复杂路线，视觉场景也更为丰富，将近一个小时的赛车戏硬核质感拉满，全程沉浸高燃，影片达到了顶级视听工业大片水准。韩寒很会在保持速度的同时放大剧情张力，很抓人，增强大银幕的爽感。推荐IMAX，音效做的特别棒！,4,2723,2026-02-17 11:13:31,178,1
飞驰人生3,1,完全超乎我的预料，简直屌炸天！,5,2526,2026-02-17 11:09:03,15,1
飞驰人生3,1,这个系列每一步都走得很扎实，第一部讲求生，第二部讲求胜，第三部整个格局和立意都打开，在具备高度赛车专业度、娱乐观赏性的基础上，又蕴藏着手术刀一样犀利的表达，核心还是上一部那句话：“我是尊重规则，但是得他妈的公平啊！”看到代表传统“手艺人”的张驰要为自己争一口气时，会感受到英雄迟暮的怅惘倔强和血性涌动，也不得不感叹主创对于时代情绪和科技变革的精准把握，就在电影上映的这几天，AI正掀起一场新的革命。我们有理由相信，“纯手开出来”的赛道，永远会比AI快上0.1秒，喜欢最后张驰和孙宇强在戈壁旷野上沐风而行的镜头，很浪漫。,4,1710,2026-02-17 11:14:48,259,1
飞驰人生3,1,这哪是路书，分明是他妈的情书！,5,700,2026-02-19 15:27:25,15,1
飞驰人生3,1,前面的文戏有多难熬，后面的赛车戏就有多爽，韩寒根本不爱电影，他就是踏马的爱赛车啊，这部里的戏剧冲突多少生硬了一些，喜剧笑点的比重也被调低了，是故意的还是写不出新段子了咱也不知道，所以那些奔着沈腾和喜剧去看的观众可能会失望，但如果是奔着赛车场面去的观众，尤其是再买一张IMAX的票，看着最后将近四十分钟的赛车戏，简直爽到飞起头皮发麻，韩寒对赛车真是爱的深沉，那种赛车狂飙的速度感，引擎的巨大轰鸣，会将喜欢这一趴的观众，死死的按在座位上，眼睛全程紧盯屏幕，到最后赛车冲过终点线才敢放松下来，一直到影厅灯光亮起，观众才发现这个美梦已醒，但我相信那份被电影燃起的激情和热血，会被观众带出影院，留在普通平凡的生活中，为自己热爱的事情拼尽全力，真的好幸福啊！,4,621,2026-02-18 20:33:56,323,1
飞驰人生3,1,起码它是个正经电影，编剧有最基本的逻辑性,4,434,2026-02-18 00:54:14,20,1
飞驰人生3,1,沐尘100夺冠不是开金手指，是记星的特训、宇强的精准、林臻东的相助，是事在人为的努力，逆袭剧本写得合理又很热血。,4,791,2026-02-17 11:24:06,56,1
飞驰人生3,1,酣畅淋漓，不负众望！整体在保持第二部水准的基础上有所突破，新的团队协作和战略非常精彩，和其他车队的缠斗更是惊心动魄，扣人心弦。让人惊喜的是除了张驰外其他角色也在发光，叶经理在失业和就业之间反复横跳，他的角色更加立体；霸气侧漏的林臻东竟然成为笑点担当；尹正铺开的路书犹如神兵天降，他和张驰可谓过命的兄弟。后半程比赛激动人心，更纯粹，更专业。而赛场之外的人情冷暖，也始终与赛道上的热血相互交织，一句“你们这种人啊，只能在赛场上赢”还是道破了现实和理想之间深刻矛盾。我相信有很多人像张驰一样，被现实一次次打倒，热血被一次次浇灭，但即便遍体鳞伤，即便被现实逼成变成疯狗，也从未放弃，这便是飞驰系列核心的意义。,4,693,2026-02-17 11:14:05,300,1
飞驰人生3,1,换轮胎那段真的太帅太帅太帅了！,5,369,2026-02-17 21:49:04,15,1
飞驰人生3,1,跑道榨干机能，热爱榨干潜能。百强打不开的文件夹里，是少了前盖和后胎的战车，是无数次换胎训练节省的分秒，而那个密码他永远无法破译。是排位赛后在游乐场解压却更难过，是开了半米也能提供的情绪价值，是在砂石和柏油之间选择出的第三条路。那是一串用热爱编出来的密码，是一封拿路书跑出来的情书。,4,204,2026-02-17 16:58:23,140,1
飞驰人生3,1,明年可别再折腾老头了…,4,178,2026-02-19 18:49:08,11,1
飞驰人生3,1,其实国产片拍到第3部还质量在线的真地不多。结局当然没什么悬念，但过程是精彩的、专业的，镜头调度流畅，剪辑没有冗余，笑料和抒情都不过分，人设又没有凹草根或精英，都在一个舒适的区域内。主题其实是有变化的，人还是机械？人还是技术？显然前者才是根本。,4,232,2026-02-17 21:22:15,121,1
飞驰人生3,1,本anti-ai古典型观众狂喜的是，在满是科技的赛场上，张驰这样的“老艺术家”还在坚持手搓！“抢秒换胎”这种极致战术就是得张驰、宇强、记星这样的铁三角展现才最爽，把弯道刹车点扛到最远，把轮胎功能磨到极致，用10%的视野开最惊险的路段，所有困难都是“逆风翻盘”局里的顺风因素。热血很重要，为什么热血更重要，七年了，道阻且长的时候很多，但奋力一搏的时候更多，韩寒很迷恋这种极致时刻，我也不得不说，人生的确需要这样的魅力时刻。,4,376,2026-02-17 11:24:09,210,1
飞驰人生3,1,沙溢也不知道是演的好，还是化妆画的好，那股子国企领导阴阳怪气虚情假意的感觉表演的是惟妙惟肖。,4,97,2026-03-07 23:33:44,46,1
飞驰人生3,1,虽然这部电影是《飞驰人生3》也是电影IP系列的第二部续集，但是我觉得比前面两部都要好看，本来以为不会有很多的赛车戏，结果满满的都是赛车的速度与激情，而且这次的剧作比以前还要丰富，而且有大国自信。F1精彩也不过如此吧。,5,520,2026-02-17 12:55:45,108,1
飞驰人生3,1,春节档第一爽片，在我看来这个系列只要把沈腾+赛车这两个最重要的元素拍好，基本盘就稳了。这部干脆全程只围绕沐尘100拉力赛这个最难的洲际赛事做文章，格局打开了，剧情也更紧凑，有沈腾在不缺笑点。韩寒很清楚自己拍的是赛车，讲的是人生，人无论多大年纪，聊到自己的爱好，眼里都会有光。如今来看韩寒当年选沈腾来演张驰真的一绝，看似云淡风轻笑看人生蹉跎，只要上赛场就能坚毅发光，什么困难都敢闯，什么破路都敢开，三部下来就是他的人生剧本，人生厚度远非电影里的资源咖车手能比。,4,255,2026-02-17 11:56:02,229,1
飞驰人生3,1,比前两部好看！张本煜和魏翔实在是黄金绿叶，太喜欢看他俩演戏了。张本煜属于那种平地陡起波澜的诡谲风格，始终有一种隐约的危险感，让人很难预期他下一秒会做什么，也因此始终会关注他到底要做什么。而魏翔则是平实中见狡黠，特别喜欢他那句台词，“你知道你们团队里还需要什么人吗？需要一个坏人。” 然后咧嘴一笑，开始反杀。很喜欢电影的立意，讲的是相信只要有能力就能取得成绩的朴素个体，和城府深沉的系统之间的抗争，很是意味深长，讲的是赛车，又不仅是赛车。沙溢很好，把一个扮猪吃老虎的上位者演得生动极了。电影里还有很多dry humor，冷不丁能让我笑出声，不得不承认我的笑点和这部电影很在一个频道（,4,69,2026-02-17 11:29:42,290,1
飞驰人生3,1,一部剧本、演出、剪辑、拍摄都找不出问题的优秀商业大片，再加上沈腾、魏翔、沙溢这些怎么演都能让我笑出来的演员，这次飞驰3和张驰一样，发挥超稳，绝对是春节档最值得看的一部。电影里不仅有一如既往对坚守热爱的刻画，还有人情世故的现实、人和AI系统同台竞技的精彩对决等，这么多元素融合一点不乱，节奏还很稳，飞驰人生现在就是一台状态拉满的优秀电影赛车了！这个春节档努力跑吧！ps，第一次get到黄景瑜，好帅！,4,291,2026-02-17 11:26:28,198,1
飞驰人生3,1,“输给日韩我能换球员教练，如果他们垫底，火就烧我身上啦，中国足球你不看吗？”哈哈哈哈哈哈,4,57,2026-03-01 19:48:21,44,2
飞驰人生3,1,"好燃，看的热血沸腾，明知道主角会排除万难成功，但还是忍不住被牵动情绪跟着紧张，好像真的在看一场拉力赛一样。沈腾真的是一个好演员，他真的成为了张驰，小人物的挣扎与对抗，让我想到了周星驰的苏乞儿。
全员演技在线，节奏紧凑，配乐做的也很好，镜头语言更是专业级别的，韩寒赛车手的含金量还在叠加，最重要的是依旧好笑！好看！
前情回顾中，让张驰这个人物更饱满了，三部全看过，怎么不算是张驰的家人呢，飒飒飒~",5,459,2026-02-17 11:29:20,197,2
飞驰人生3,1,好羡慕韩寒啊，喜欢赛车就可以拍赛车电影还很赚钱，还能在电影里面配上自己喜欢的摇滚乐（剧情前半段真的压缩到30%就好了，平淡无聊意料之内，赛车场景精细度不如F1但却拍出了另一种所谓草根的看头和味道）,4,70,2026-02-21 00:03:43,98,2
飞驰人生3,1,居然颇为大胆地删繁就简且集中火力，让叙事更利落，发挥更出彩。一方面，有足够充分的篇幅来细心打磨、呈现一场可谓精彩的比赛，翻山越岭、飞沙走石的沉浸感扣人心弦而又张弛有度，对体力、心智与胸襟的考验亦是如虎添翼，而第一部的宿敌在这里也有了动人的托举与成长，因此另一方面，得以让张驰三人组在圆梦之旅上有了明晰、笔直的路径，他们奔向终点，是为个体、为情谊、为热爱在拼命，也是为一口气，这口气里，有人被规矩倾轧、被资本操作、被现实碾压多次后依然不改的赤子之心，更有对抗以中速天梯为代表、已经走偏的宏大叙述的悲壮决心，那种破釜沉舟的燃，就别有一番骨气在。,4,258,2026-02-17 11:22:40,270,2
飞驰人生3,1,韩寒驾驭赛车题材的能力，已经无出其右。全新的“最难的洲际比赛”，涵盖柏油路、砂石路、戈壁、高海拔组合弯等多种复杂地形，相比前作的挑战性和观赏性大幅提升，影片以极具张力的视听语言定格赛道的旷远与竞速的燃感，尤其是我看的IMAX版，巨幕的无边界视野与沉浸式环绕声场完美融合，身临其境地体验了一把速度与激情。更燃的是，“不是所有比赛都发生在会议室里”，我们不仅要关关难过关关过，还要赢得漂亮！,4,329,2026-02-17 11:19:58,193,2
飞驰人生3,1,Get到了黄景瑜,4,41,2026-02-24 19:13:43,8,2
飞驰人生3,1,"我们在太多耻辱和不甘的失败之后对自己说过输赢根本不重要。今年是2026年，韩寒拍飞驰人生已经七年，拍电影十二年，已经距离他作为赛车手拿下最后一个年度冠军也已经过去了十九年。已经这么长的时间过去了。如果输赢真的那么不重要，那就让他赢一次又能怎么样？非常喜欢电影最后耳麦里那声平淡的“我们赢了”，有一瞬间想过张弛这样的选手是不是就应该死在赛场、和他的车一起燃烧殆尽，但其实真实的人生更像这个结局，所有荣光和遗憾最终都归于平静。但是“人始终要相信梦幻存在”，这是我们活这一趟的意义。

很尊敬韩寒，他为自己的热爱交出了这样的作品。看电影的时候一直在想，那我呢，我能为我的热爱留下什么样的作品？",5,59,2026-02-21 17:54:57,293,2
飞驰人生3,1,永远要去做自己相信且内心热爱的事情，才有机会感动观众 。,4,26,2026-02-21 00:37:24,28,2
飞驰人生3,1,比F1差10倍，比惊蛰无声好一百倍，综合一下四星。,4,107,2026-02-19 01:58:50,25,2
飞驰人生3,1,有段山间穿行，换个配乐，脑海里配上了《闪灵》开场那段，当然阿鲲的配乐非常摇滚，非常好地引导了观影情绪的调动，最后那段两人背车而行的场景，真想给它来一个定格静止帧，这种演出手法在动画里叫“harmony”，指的是在动画过程中突然出现一张风格化的静止画面，出崎统、山内重保等人的harmony都很出名……包括一些比如高潮段落突然的消音手法，还有国际化背景下的团队竞赛，让它看着特像是一部热血的体育竞技漫改电影，刺激，流畅，毫无尿点。好看的电影真是各宅入个眼，能引发非常强烈的共鸣和联想。,4,35,2026-02-17 14:25:04,241,2
飞驰人生3,1,技术和专业性大升级，这部分是得益于前两部成功和积累，已经是华语最专业的那类赛车电影了。拍赛车运动片很容易陷入自大ego矫情和找不到立场，但这部是韩寒真正的“集大成”。这是由一定的文艺性和“飞驰”系列的笑点和赛车戏的中和结果。不同于前两部的loser之歌，这部是讲专业技术上，也就是专注赛车上，赛车之外人的不公与权欲。从电影视觉，音效，技术，我觉得他的创作是有用心地去做。,4,106,2026-02-17 11:39:26,185,2
飞驰人生3,1,"1.飞驰人3不好笑，甚至不像“飞驰人生”的喜剧，人物凝重，还设计了很多中、全景来呈现人物渺小、无力，但后半程近1个小时的沐尘100拉力赛，在足够抓马的戏剧中兼顾专业，体验很好。
2.沐尘100的赛道采用了双路线并行的设计，北线展示了赛车的轮胎策略和机械的极限，南线展现了极致的过弯、超车和极限速度。视听上，赛车的质感很写实，除了捕捉了大量碰撞和砂石的细节，还大量使用跟拍，比如张弛玩“脏”的让对方赛车撞上石堆的低角度跟拍，类似的还有林臻东超车时的低角度主观视角，营造把观众放在副驾驶的感觉，电影还大量运用航拍来展现赛事全景的转播视角，整体视觉有张力。
3.飞驰3不是大国崛起的叙事，反而点到了中国体育的痛点，最后是在冷漠的科技爆发下，赞美人性的温度，是张弛和宇强，以及团队之间的合作和成就，这点不错。",4,72,2026-02-17 17:12:54,350,2
飞驰人生3,1,"看之前:怎么还能拍到3啊
看之后:第四部什么时候上映",4,45,2026-02-17 23:09:36,26,2
飞驰人生3,1,你们团队缺个坏人啊,4,23,2026-02-27 20:33:18,9,2
飞驰人生3,1,前半段老套俗气，后半段热血沸腾，赛车段高潮好评，幽默中规中矩，不得不说，魏翔真的是特别好的喜剧人，几个表情一两个动作就逗人捧腹，沙溢差评，综艺上多了，反派人设撑不起来,4,40,2026-02-20 21:55:46,83,2
飞驰人生3,1,张驰这么多年还是没学会职场里的尔虞我诈，毕竟他只是个纯粹的赛车手，所以他是想要一个公平的比赛规则，但生活从来没有公平这一说，如果没有叶经理这样的“坏人”张驰只会一直吃哑巴亏,5,52,2026-02-19 18:16:20,86,2
飞驰人生3,1,最感动的是林臻东在真空带把张驰带出去那一幕 以及面对日本对手时 张驰向李伦提供的帮助 赛车从来都不是一个人的胜利 个人技能再强也需要整个团队的协助来完成终局 世道艰难 我哋照行 坚持做自己 对的队友会聚集在一起走下去的,5,56,2026-03-01 14:54:09,109,2
飞驰人生3,1,以为结局还会走be路线，没想到这次是绝对的圆满，大过年的就是要看点开心的he才应景,5,144,2026-02-17 16:05:45,41,2
飞驰人生3,1,最大限度地压缩文戏来扬长避短，不再执着于堆砌金句、笑点与戏剧冲突，甚至弱化了竞争对手的塑造，而是回到对赛车本身最纯粹的渴望，反倒有股不问成败、只为上场的侠气。不得不说韩寒是真的在用热爱打破偏见。,4,18,2026-02-17 18:47:21,97,2
飞驰人生3,1,韩寒拍拉力赛确实夯，全方位的好看，速度感、紧张感、故事感、人和人之间的情感都好看。看到第三部，对张驰这群人居然真的产生感情了，好想看他上一次领奖台。兄弟情拍深了果然就难免像是爱情，宇强这一部终于不是工具人了。虽然“至死是少年”如今已经变成了一句贬大于褒的话，可在我看来韩寒塑造的的确就是一种抱有少年心气的人生浪漫。变坏的大人才只看利弊，好的大人抛不开对错。,4,87,2026-02-17 13:00:10,178,2
飞驰人生3,1,后半段的赛车戏拍得实在太燃了，超出预期的燃（而且非常解气），不是那种「全员集结复仇」的无脑燃法，而是那种「实力＞黑科技」以及「力压资源咖」的燃。这系列拍到现在，好就好在没什么无用的支线剧情，一大半的戏码都给了赛车场。前半段把人物和故事讲透，后半段则是类型完成度的兑现。,4,24,2026-02-17 15:07:23,134,3
飞驰人生3,1,2026.03.18 IMAX：好看，挺燃，赛车戏比较集中，也没有太多废话，笑点很多。这个系列能拍到第三部很棒了，如果能一直拍下去，会逐渐成为精品，在国内赛车电影太少了，期待后续更好的作品。,4,30,2026-04-01 12:37:01,95,3
飞驰人生3,1,毫不夸张的说本片贡献了华语影史最顶级的赛车戏，甚至没有之一！七年时间，韩寒将这套电影完成了三次迭代升级，从巴音布鲁克到沐尘100拉力赛，从人与人的较量到人与系统、科技的较量，赛道不断升级，剧情爽感拉满，第三部教科书级的赛车戏运镜和调度，航拍跟拍镜头的运用把沉浸感十足，主角的神操作燃到炸裂。剧情也很完整，沈腾的张驰依旧是灵魂，从野生车手到冠军的成长弧光太戳人，尹正、张本煜的铁三角重聚满是默契，群像塑造依旧是亮点，张驰和孙宇强的兄弟情，在这一部里变得更加饱满。他们不再是单纯的搭档，而是有过摩擦有过矛盾、有过理解的知己，赛道上的速度与激情固然震撼，但赛道旁的并肩作战，才是最温暖的底色。尤其喜欢的是藏在细节里的系列彩蛋，合唱《光辉岁月》、巴音布鲁克的王后这些名场面callback，让老粉能会心一笑。,4,41,2026-02-17 22:11:36,350,3
飞驰人生3,1,春节档适配度最高的头号种子选手，整体相比前作实现了进一步的升级。剧作上则继续聚焦张驰的逆境，从积极组建队伍，到被人当棋子欺骗，再到发现真相绝地反击，过气车王绝地反击，不向权力屈服，向真相宣战。这一路来，张驰一直在努力超越自己，或许他并不是天资最优渥实力最强悍的，但他确实证明了自己是最热爱的，以及“热爱”的力量究竟可以让一个普通人走多远。最后的赛车段落依然十分扣人心弦，展现出很高的工业水准和震撼的视听体验。这个系列也的确展现出稳定的品控能力，至少在赛车类型这个赛道上来看，没有任何对手。,4,107,2026-02-17 12:49:34,244,3
飞驰人生3,1,质量很稳，系列电影拍到第三部还能保持高水准，还蛮少见。前半部分在讲现实的辛酸，后半部分讲梦想的超越。韩寒这次松弛且克制，以喜写悲，刻画出了普通人在人情社会面前的无力与妥协，也有力地讽刺了资源咖现象。后半程的赛车戏充足，扣人心弦，尤其喜欢引擎盖翻起来的设计，很有想象力，喜剧感与惊险感兼备。反高潮的处理颇为大胆，表意清晰：相比于胜负，能踏入赛场完成属于自己的超越性瞬间，才更重要。,4,53,2026-02-17 11:18:04,189,3
飞驰人生3,1,是很成熟的商业片了，导演知道自己要拍什么，观众知道自己在看什么，我觉得这样就很好,5,45,2026-03-01 16:56:52,40,3
飞驰人生3,1,张驰飞了三个春节档，导演的节奏处理也更加成熟。每一部《飞驰人生》都是一场比赛，有天然的紧张感。主角一定是会走过终点的，因此电影一直在用不同的方式处理结局，让赛车过程比结局更值得享受。这次显然也能看到经费和发动机一起燃烧。我旁边坐了带小学生娃的一家三口，每个人都看得很开心。珍惜身边的队友，等伙伴系好安全带再发车，可能是比赢更重要的东西。除此之外，赛车戏是绝对的主角，主创也是真热爱。导演是一个喜欢赢的人，他不会给你坏结局。收获两个小时的心潮彭拜，还是很值得来这一趟的。,4,24,2026-02-17 17:26:38,234,3
飞驰人生3,1,对赛车一无所知，但不影响这部电影的观赏性。看完想起前几天Alex徒步攀爬台北101，人类正面临一个试图以身体极限对抗机械和AI的时代。或许螳臂当车，但却正是这不自量力才是证明人是人，不是设定好的程序。,5,25,2026-02-23 21:24:42,100,3
飞驰人生3,1,"张驰开头那么顺，我就感觉不对劲儿，看到都开始选人组队了，刚放下心来，结果来个大的。

叶经理：我见证了张驰一路以来的坎坷，坎坷咋来的你别管。

最准的路书
最强的车手
最牛的工程师
最好的林臻东
最脏的叶经理",4,33,2026-02-19 20:07:40,104,3
飞驰人生3,1,老汤老佐料，但是比第二部好，就是纯粹的赛车电影，没有太多花里胡哨的东西，当然，也没有女性角色🙃韩寒在直男赛道还是一骑绝尘，热血、冷幽默、赛车，三板斧依然能砍下春节档。,4,17,2026-02-22 13:36:19,83,3
飞驰人生3,1,尽管剧情俗套，但赛车画面真的很燃,4,32,2026-02-22 01:04:14,16,3
飞驰人生3,1,开年第一笑：外卡赛车手的“复联”一如既往的黑色中二，赛场之下的暗潮涌动才是中国文化的博大精深，“风洞是回字型的”“我以为是直来直去的呢，没想到这么多弯弯绕绕！”,4,28,2026-02-17 15:14:31,80,3
飞驰人生3,1,同样的套路，但是就吃这一套～,5,42,2026-02-21 23:54:50,14,3
飞驰人生3,1,马也大哥再次带队逆袭翻盘，飞驰系列后半段赛车场景一直是招牌，燃点很足，斗得很爽，相比前两部，剧情方面这次基调严肃很多，舞台更大，对手也升级了，翻盖车还能这么开也是绝了，安全带绑好再发车那段，我边上大哥一句“驾考满分”笑死。韩寒的叙事风格和情怀表达很有辨识度，但我更佩服的是整个主创团队的用心。这个系列特别考验团队默契和执行力，电影院里人很多，现在飞驰宇宙的口碑和观众缘已经相当扎实了，尤其是这一部的群像塑造很成功，每个人物都立得住、有温度，还是值得一看的,4,12,2026-02-17 22:56:38,227,3
飞驰人生3,1,最后林臻东赢了就可以了，没必要一直赢。就像灌篮高手一样遗憾才是完美。还有不要再拍第四部了，不然就像速度与激情一样地球都装不下了。,4,20,2026-02-18 14:58:50,64,3
飞驰人生3,1,很成熟，靠个人英雄主义战胜依赖科技的敌人本来就是一种商业片的升级（洛奇5打机器人）。大量的赛车细节，让这场悬殊的比赛，可信度得到极大的提升，好几个地方看得荡气回肠，有时间会去二刷。但我更欣赏的是韩寒对八零后一代男性的记忆留存，那种年迈的豪迈，残破的幽默，绝处的觉悟，是这一代人反精英反主流反物化，依然理想主义的写照。他在电影里反复提到是否成熟的问题，从一开始试图迎合规则、磨平棱角，到赛场上不顾一切、绝不刹车的漂移。那些看似成熟的妥协，本质上是懦弱与精致的利己；而看似幼稚的理想主义，反而藏着最珍贵的勇气。,5,18,2026-02-17 15:49:11,253,3
飞驰人生3,1,去年看《F1》手表提示了6次心率过高，没想到今天看《飞驰人生》手表也提示了4次。有纯粹的赛车，有跟我差不多年纪的《永远不回头》，有叶霍纳大战百强toto，还有完全不隐晦的开团中国足球和XX主义，这已经是很高级别的“要啥自行车”了。,4,14,2026-02-28 08:18:57,115,3
飞驰人生3,1,永远不回头！,5,17,2026-02-18 16:51:02,6,3
飞驰人生3,1,真心比预期好看很多，整个系列最佳。在全员AI的时代歌颂草根、歌颂匠人精神，保留喜剧元素的同时没有生硬搞笑，增加了很多对现实的辛辣针砭值得咂味。另外作为一部赛车电影，近一个小时的高难度拉力赛爽感拉满，细节足、够专业、十分流畅，结尾处理的也很高级！,4,15,2026-02-17 17:54:48,122,3
飞驰人生3,1,真心好看，我愿称之为华语赛车片的标杆。韩寒因为自身是赛车手，对这种题材的片子游刃有余，尤其是最后联手冲刺的片段，紧张得我手掌都攥紧了。沈腾表演依旧很稳，春节档又有他可太热闹了太有趣了！,4,260,2026-02-17 12:06:59,92,3
