movie_name,comment_type,comment_text,rating,votes_count,created_at,comment_length,source_page
飞驰人生3,1,有点超预期的好看，新年的第一剂热血鸡汤喝的畅快淋漓。整个电影既轻松诙谐又热血激情，太喜欢张驰和孙宇强这两个人了，虽然遭遇过很多不公，但依然活得纯粹干净，对热爱的赛车，永远深情认真。记星质问外国人“为什么不检查涡轮”时，真让人心疼啊，林臻东牺牲自己那段也很让人感动，整个赛车过程让人激动又有点紧张。虽然追逐梦想的前路总会遇到重重困难，但那些始终保持纯粹认真的人，才是最大的赢家。,4,4,2026-02-17 14:17:46,188,10
飞驰人生3,1,太燃了，果然纯粹的热爱才是最令人动容的！,5,1,2026-02-23 14:56:47,20,10
飞驰人生3,1,简单三个词概括：速度激情与包袱,4,10,2026-02-18 00:37:17,15,10
飞驰人生3,1,一直觉得《飞驰人生》是韩寒拍的最好的系列，依旧克制了自己的直男幽默，认认真真拍赛车，把换轮胎都拍得很燃。除了片头的回忆，后面闪回，还有集结前作赛车手们，都有点情怀在了。结尾赢的时候，虽然很意料之中和理所当然，但采取了一种平静的处理方式，显得很动人。,4,3,2026-02-18 00:11:54,124,10
飞驰人生3,1,最后冲线夺冠那一刻，影院里好多人不约而同地舒了口气然后鼓起掌来，那种集体释放的感觉好久没体验过了,5,12,2026-02-19 18:39:50,48,10
飞驰人生3,1,比预想的好看 片头看到熟悉的面孔出来感动了 林臻东有没有钱都真帅哈哈,5,26,2026-02-17 21:21:32,34,10
飞驰人生3,1,算是超过预期，视听语言比2有升级。赛道更丰富了，有森林戈壁沙土路。难度和观赏性也比之前升级了，最后戈壁那一段可以用视效奇观来形容。喜剧的部分是自然的，也保留了韩寒的幽默感。适合辛苦了一年就想去电影院收获纯热血和兄弟情感动的观众。,4,9,2026-02-17 12:36:34,114,10
飞驰人生3,1,3.5,4,0,2026-03-01 11:35:50,3,11
飞驰人生3,1,"爽是真爽，韩寒确实学会了调动情绪
但再这么写模板作文，明年我要喷你了",4,2,2026-02-18 23:17:44,34,11
飞驰人生3,1,在影院里和心爱的女孩子拉着手紧张得看完了,4,0,2026-03-07 01:30:51,20,11
飞驰人生3,1,m2612:玩车的好编剧是个好导演！不服干就是了，让他们服！,4,4,2026-02-18 23:00:38,30,11
飞驰人生3,1,期待续集。中国最好的赛车电影系列，每年春节档上映，座无缺席，场场爆满，好评如潮。混合地形拉力赛比专业赛道F1好看多了，精彩多了，能漂移+飞车，F1只是转圈而已。拉力赛不仅靠技术，更靠团队默契，还得有大量的金钱支持才行啊！,5,3,2026-02-18 21:24:13,110,11
飞驰人生3,1,作为高举女性主义大旗的影迷的观影滑铁卢有二，一是会为教父流泪，二是真的喜欢飞驰人生。,4,1,2026-03-01 20:08:28,42,11
飞驰人生3,1,有蛮好看的，没有看第二部，这个比第一部好看多了，观感很像f1大电影。还有古早少年漫画的方法论，就是曾经的敌人成为新的队友，打败更大更坏的敌人。我看近年的少年漫画都不太燃得起来了，这个燃起来了。（最近燃得比较多的还是进击的巨人，再就是咒术回战的日车宽剑）,4,1,2026-02-19 16:18:23,126,11
飞驰人生3,1,前两部没看过，赛车拍的很燃，挺好看,4,2,2026-02-18 21:09:07,17,11
飞驰人生3,1,"说起来挺心酸的，普通人倾家荡产，献出所有热爱，还得小有天赋，才能与资本一战。甚至张驰本身就算不上一个普通人，他的能力与天赋已经站在许多人前面了。

然后又过分理想，因为即使是有天赋有能力的大多数人都无法赢得比赛。而人一生能有一次站在资本对立面都已经是小有成就的了。

所以呢，所以…既然人生中得不到，那就随着电影一起爽，爽到就是赚到。",5,8,2026-02-17 15:46:28,167,11
飞驰人生3,1,3.5星。跑道榨干机能，热爱榨干潜能。,4,0,2026-03-31 22:33:04,19,11
飞驰人生3,1,BGM挺燃的，画面也很漂亮，虽然剧情一眼望到头。,4,1,2026-03-02 08:35:04,24,11
飞驰人生3,1,牛的，爽到了。,5,2,2026-02-21 13:51:30,7,11
飞驰人生3,1,看出为了不重复1和2的一些不同的镜头选择，也看出了韩寒真爱赛车的心。没什么毛病的、合格的春节档电影。Don't stop me now和永远不回头是亮点。,4,7,2026-02-22 01:08:39,77,11
飞驰人生3,1,3.5 虽然剧情啥的也没悬念，但是赛车真的太帅了，赛道设置很丰富也蛮有看头的，后半程捏把汗，看得肾上腺素飙升，大爽片在春节档还是值得看看爽一下,4,1,2026-02-21 22:35:11,71,11
飞驰人生3,1,毫无新意也确实毫无新意，放在赛车电影里算是很平庸的，但放在春节档里又算是好的……,4,8,2026-03-01 21:23:41,40,11
飞驰人生3,1,记星这个角色话不多，但每次团队遇到技术难题，他默默拿起工具的背影就让人特别安心，这种用行动说话的可靠，比什么豪言壮语都更有分量,5,1,2026-02-19 17:33:57,63,11
飞驰人生3,1,一帮有趣的男人处心积虑给大家贺岁，顺便把钱挣了，其心可贺！,5,4,2026-02-21 22:03:08,29,11
飞驰人生3,1,正月初五财神日在武汉武商Mall七楼看的，本想剧情不行就睡个觉，但全程椅子震动，原来是4D，剧本绝杀，向潜规则和不公平挑战！感动得睡不着了。,4,1,2026-02-21 22:15:49,70,11
飞驰人生3,1,故事范式讲差不多了，但是赛车戏还是好看的,4,11,2026-02-17 11:45:34,20,11
飞驰人生3,1,韩寒拍赛车确实有一套，拍得热血浪漫！拍得很美！前面太拉，后半段加1星,4,0,2026-03-01 11:05:06,34,11
飞驰人生3,1,我喜欢这样的故事，相比《F1》，我更喜欢这部。都给我看坐起来了。,5,0,2026-03-04 00:02:52,32,12
飞驰人生3,1,今年春节档看得最尽兴的一部，还得是沈腾，这一部更加成熟。叶经理的加入，“取经”四人组终于合体，这样的组合很难不成功。科技推进社会的进步，但我不信我们对抗不了ai，哪怕我知道会赢，但我想看怎么赢的，比赛全程都让人心潮澎湃。,4,4,2026-02-17 17:19:09,110,12
飞驰人生3,1,3.5。满足了我19年对第一部的期待。,4,1,2026-02-19 16:59:39,19,12
飞驰人生3,1,真的被那个贴地飞行的镜头震撼到了！感觉镜头都要撞到地上了，速度感爆棚 全程跟着赛车漂移，这种视觉体验在国内电影里真的少见，太牛了！,4,2,2026-02-17 16:25:48,65,12
飞驰人生3,1,依旧是重建车队的路数，到第三部已经多了几分成熟，对商业团队内部的权力关系之下的黑暗面有所落笔。从个人成就向的巴音布鲁克到组建团队参赛的沐尘100，再重新回到个人车队，上至巅峰又落到纯粹的自我与热爱，主题保持延续性又刻画出了历练带来的洗礼。赛车戏的剪辑依旧出彩，极限换胎的分屏和倒计时的设计，以及不时出现的连贯镜头都在不断巩固整个ip在国内的翘楚地位。,4,6,2026-02-17 17:11:49,175,12
飞驰人生3,1,观感上是绝对满足的，韩寒还是在自己的专业领域里毫无顾虑的发挥赛车的专业观赏性。摄影依旧牛逼，但是剧情很老套，不过还是很燃！,5,87,2026-02-17 12:36:04,61,12
飞驰人生3,1,肾上腺素真是飙升，又一次为张驰捏一把汗。这应该是很成功的大男主了，完全围绕他展开，是一大魅魔来的。sss赞！,5,1,2026-03-24 02:49:39,54,12
飞驰人生3,1,个人很喜欢的一个系列，但3感觉还可以更好,4,2,2026-02-18 11:05:20,20,12
飞驰人生3,1,比其他春节档更能调动情绪,4,1,2026-02-23 15:54:06,12,12
飞驰人生3,1,《飞驰人生3》，果然没有尿点，比赛全程紧张到揪着心看完。已推荐给烨烨舅舅和妗妗，他们准备明天来看了…,4,2,2026-02-20 16:12:08,50,12
飞驰人生3,1,爽片，推荐到电影院体验竞技体育的快乐，这个系列就纯粹地开车开下去，就够好看了。没想到我也有嗑不动的一天，王和王后已经超越cp往亲情上走了，抱住安慰本煜那一幕让人真的很想喊老谭一声妈。,4,1,2026-02-22 20:41:39,91,12
飞驰人生3,1,笑点少了，赛车戏更多了的感觉，后半部分爽翻，算是保持住了第二部的水平，遥遥领先春节档问题不大。,4,13,2026-02-17 12:09:40,47,12
飞驰人生3,1,昨天去电影院贡献了票房，总体觉得不错，至少是一部真诚的电影，可以看出主创传达的热血与激情，我愿意给每一部真诚的电影满分，特别是中国电影。其实每年的飞驰人生的主题都差不多，但每次看都会觉得有属于中国人自己的激情，很细节。韩寒收集了各种资源表达了对赛车的热爱，不光是剧情，还有很多细腻的小情节，以及各种“周边”彩蛋。感觉诚意满满，非常用心。几位主角演技也都在线，沙溢综艺里那么搞笑，在电影里演的也是有板有眼，非常认真，一点不出戏，真的是厉害👍🏻希望明年继续有佳作,5,5,2026-03-02 09:17:59,229,12
飞驰人生3,1,剧情不如前两部，文戏太薄了，赛车拍的不错，有点f1狂飙飞车的味道，但是感觉太长了，几个笑点纯靠沈.布拉德皮特.腾支撑。,4,14,2026-02-19 15:48:16,59,12
飞驰人生3,1,"“我经历过太多次不公平了”，“这不还有条缝吗”，“这已经不是路书了，这是一封情书”。

燃爆了，夯爆了！",5,17,2026-02-17 15:39:29,52,12
飞驰人生3,1,这一次《飞驰人生3》的多地形赛道，真的把各种复杂路线玩出了花，很有一种玩游戏过不同关卡的新鲜感，哪怕不是赛车迷，看到赛车在各种路线里一路过关斩将，也能跟着一起热血沸腾。文戏方面电影抓住了一个很重要的时代情绪，那就是个人在面对不断升级的科技与系统，既憋屈又想赢的那种心情。而张驰最终如同他的名字一样，以一种拼尽全力的姿态冲了出去，某种程度上，何尝不是电影在马年给予观众最大的祝福：我们都能像那匹羁傲不逊的马一样，飞驰出人生的困境。,4,16,2026-02-17 12:09:57,214,12
飞驰人生3,1,文戏流畅，赛车戏精彩，值回票价！,5,2,2026-02-20 19:01:48,16,12
飞驰人生3,1,这部真的是纯热血，飙车的部分多了不错不错,4,0,2026-02-24 10:43:26,20,12
飞驰人生3,1,韩寒是全亚洲最会拍赛车的导演没有之一,5,9,2026-02-22 22:04:56,18,12
飞驰人生3,1,现在的评分很符合。,4,1,2026-02-21 17:53:48,9,12
飞驰人生3,1,真正意义上的国产赛车大片，也是本系列最佳。无论剪辑、剧本节奏、配乐都全面提升，几位主演表演收住+默契，文戏有了更多张力。赛车部分复杂战术节节递进，给出远超预期的真实临场感。预估春节档最受观众喜欢的一部，也可能票房最高。,4,11,2026-02-17 23:31:33,109,13
飞驰人生3,1,“带着车队拿了多少次冠军，输了一次就把我给开了”，是你吗霍纳,4,1,2026-02-26 13:28:28,30,13
飞驰人生3,1,【B】如今的国产类型片已经拥有了制造优质套路的实力，在基本底料扎实的大前提下（给足的制作资源，与审美跃升的包容性），复用前人的优秀经验来［扬长避短］的能力。在上述优秀品质的加持下，韩寒的进步当然是肉眼可见。但真的仅此而已吗？韩寒真的只是拍了一部赛车版的《雄狮少年2》吗？不如说在中登主角团那人情味十足的造梗文戏（叶师傅快车的三人聊，张驰讨好百强和上层的算计，和恰到自然的自嘲与解构），与［倾尽所有］的个人主义下，赛车的目的性终于坚定指向《F1》那化土为燃的精神。正如早就被主流观众习以为常的资本剥削与类型套路，却始终需要这份［热血］的勇气去回应这种尴尬局面：在赛车决战那经验与实力对抗层层递进的困难局面中、在决赛之路中人车合一的痛觉反馈中、也在胜利步伐下那练换决胜胎的，关于友谊的时空蒙太奇中。,4,1,2026-02-22 14:36:22,347,13
飞驰人生3,1,只要有热爱，有兄弟，就算是一手烂牌，也能打出最漂亮的结局，是张驰，更希望是我们自己。,5,8,2026-02-17 14:33:08,42,13
飞驰人生3,1,笑点好像不如以前，但是赛车一如既往的优秀，国产赛车片没有对手，甚至可能比好莱坞的F1更好。,5,8,2026-02-18 19:47:52,45,13
飞驰人生3,1,它不仅仅是一场视听盛宴，更是一次心灵的按摩，让被生活磨钝的感官重新变得敏锐,5,4,2026-02-18 17:46:46,37,13
飞驰人生3,1,海外的支持给到韩寒。太喜欢听到“赢了”那一刻那么克制地敲一下车，真的是道尽了一路过来的辛酸与梦想达成的浪漫的碰撞。,5,21,2026-03-01 15:35:07,57,13
飞驰人生3,1,小朋友看的津津有味，很关注赛车的碳排量和排气管问题（电车时代的小孩视野）。对于第一次看这个系列的观众来说，终于GET到了什么叫大头。最后一个镜头，沈腾和尹正朝着观众走来时，看正面，沈腾是尹正的2倍；背面看，竟然还是沈腾更瘦？！,4,0,2026-02-25 21:36:50,113,13
飞驰人生3,1,看上一部的时候觉得油车的时代结束了，看这部的时候觉得真人车手的时代要结束了…享受比赛吧,4,6,2026-02-17 20:03:22,43,13
飞驰人生3,1,飞驰3现在一直被拿来和F1、镖人比较，这么说吧，视听体验上，确实F1更顶级，方程式赛道和汉斯季默的配乐是无法可比的，但故事，精神内核，笑料等元素，飞驰3胜出，更为丰满，而镖人虽然人物与打斗很精彩，但故事整体上跟飞驰3还是差较多。飞驰3，今年看过最燃最爽的一部国产电影。,5,1,2026-02-23 22:21:51,134,13
飞驰人生3,1,一样的配方 一样的热泪盈眶 这是最纯粹的赛车比赛 不是为了国家 不是为了正义 不是为了出一口气 享受比赛,5,6,2026-03-02 12:30:39,52,13
飞驰人生3,1,文戏强行降智了，最终战的确精彩，视听体验极佳，想出用换胎来结合场地赛与公路赛的人真鬼马。那就把整个系列看成两次成长遭遇精英怪，最后才是Boss 战吧，原谅第三部的文武失衡。让真正爱赛车这一行当的人挣到钱挺好的。,4,1,2026-02-19 00:36:57,105,13
飞驰人生3,1,回过味儿来，还是不如买一本书或者半本书划算，电影可以下载或者视频网站会员，看来今年的消费需要全部转向买书和书店消费了/国内体育电影之最了吧,5,0,2026-03-11 17:44:23,69,13
飞驰人生3,1,赛车和喜剧的完美结合，融合了第一部第二部的优点，沈腾就是我们中国自己的布拉德皮特,5,46,2026-02-17 17:33:31,40,13
飞驰人生3,1,关于人工智能能否取代人类，韩寒用飞驰3给出了自己的答案，无论科技怎么发展升级，人的主观能动性和冒险精神是替代不了的，这是人机对抗下人类独有的品质，没有智能辅助的手搓赛车，只有张驰能把它发挥到极致，看起来有些老派，但肯定了人的价值，科技能提高胜率，但人能创造奇迹。,4,21,2026-02-17 11:13:19,131,13
飞驰人生3,1,合格的续集，赛车拍的很燃，值回票价。今年可能是最弱春节档了吧，飞驰人生3要登顶了。,5,1,2026-02-19 22:18:01,41,13
飞驰人生3,1,飞驰1是用一场“中年危机”起步，2是用一场技术流“视觉体验”实现大幅弯道超车，3已无观众基本盘的后顾之忧，就是加足码力冲刺，剑指冠军。他终于有了底气去拍他最想要表达的东西——热爱。也是春节档最落地的视觉奇观，贴肤的沉浸感非常热血，沐尘100的确拍出了旷野感。韩寒有信奉的“道”，是“道义”的道，也是“赛道”的道，而且这道他传成了。,4,11,2026-02-17 13:09:58,165,13
飞驰人生3,1,1、老板想塞人就塞人，人事任免权本就是老板的权力。关系户也没什么要紧，太子爷也知道自己是资源咖，三人组也不是不懂人情世故和赞助商的重要性。何必给人赛车搞小动作，这是要出人命的高风险。四人因涡轮全军覆没、比赛垫底，弄得难看至极，且落人话柄。这波操作真的丑陋，我要是同行（其它车队老板），都不忍直视。2、明明是竞技体育，胜负却在“会议室里比完了”，是在讽刺2024奥运会陈梦得奖吗。哎呀呀，韩寒你还是太敢说了。,5,1,2026-02-20 01:26:17,203,13
飞驰人生3,1,一半以上都是动作导演罗益民拍的吧,4,0,2026-03-12 08:50:04,16,13
飞驰人生3,1,韩寒就是赛车类型片导演吧,4,0,2026-02-26 12:48:37,12,13
飞驰人生3,1,一群不服输的中登，不管生活怎么打压，就是不肯趴下，在人人追求躺平的时代，这种“不服输”太稀缺了。,4,1,2026-02-26 14:30:42,48,14
飞驰人生3,1,韩寒在开创一种类型片—中国赛车片…每年过年营业一次，看着爽就完了,4,1,2026-02-21 16:22:29,32,14
飞驰人生3,1,前半部节奏怪怪的，后面赛车部分比f1还好看，开场和结尾两首插曲比隔壁那部选的好太多了，“永远不回头”非常贴两个人在戈壁里的背影。,4,13,2026-02-20 16:54:11,64,14
飞驰人生3,1,飞驰人生3这个贺岁档冠军无可撼动，除了题材可能会限制观影受众影响票房，否则也许能望一望哪吒2也不一定。足够热血的商业体育电影，韩寒已经通过前两部的练手摸熟了门道，再加上从老港片学来的底子，可以说各项圆满。片尾曲差点让我在影院就脱口而唱，如果是原版也许我会更激动。毕竟是同龄人，那点趣味都是相通的,4,1,2026-02-18 20:34:20,147,14
飞驰人生3,1,从1到3，市井气少了，宏大感多了，喜剧少了，运动多了。,4,1,2026-02-21 17:49:06,27,14
飞驰人生3,1,赛车的部分比F1好。每次政治和性情都不太好。天意和才华关系写得不错，才华和技术的关系没写出彩。沙溢最好的一次。洛阳正大,4,2,2026-02-18 23:33:26,59,14
飞驰人生3,1,激情四射，脑洞大开,5,0,2026-03-08 17:18:39,9,14
飞驰人生3,1,内燃机不会被时代淘汰,5,16,2026-02-22 17:41:24,10,14
飞驰人生3,1,"【不是所有的比赛都发生在会议室里】
合着范丞丞和胡先煦就出来走个过场啊，同一个模版连用三次吃相就有点太难看了，不过谁让我就吃这一套呢，所以依旧四星",4,4,2026-02-17 15:10:24,73,14
飞驰人生3,1,7分。赛车的部分仍然很好看，故事就一般般吧。,4,2,2026-02-18 20:54:23,22,14
飞驰人生3,1,油车销量又要恢复一点了。😆,4,1,2026-02-18 23:12:19,13,14
飞驰人生3,1,有些好猜的人物走向，赛车戏还是热血澎湃😀,4,0,2026-02-21 22:38:50,20,14
飞驰人生3,1,不只是讲述赛车的故事，也是新潮科技和老派热爱的对撞。强行逆袭很少，有的只是贴近现实，讲述人们自己的和解与坚持。作为系列第三作，本部电影承载了一些别样的意义。情怀给足，节奏舒适，赛道戏份真实刺激，有热血也有情怀。不管有没看过前作，都能看进去的故事，观众或许都会被沈腾饰演的张驰所打动，故事没有强行煽情，但会被一些细节戳心。,4,5,2026-02-17 14:21:53,160,14
飞驰人生3,1,三部电影三种比赛模式，这一部直接升级为最难的洲际比赛——沐尘100拉力赛，全新打造世界级赛道，挑战双线并行赛制。后半段爽到飞起，车胎不合适就抢时间中途换胎，车前盖翻起也要在夹缝中看到前面的路，后面又利用高速坡把它甩掉。野生车手自有野生方法，常规方法跑不赢就不按常规出牌，打对手一个措手不及，韩寒骨子里依旧有着不被规训挑战一切的自我，飞驰人生就是像少年一样飞驰。,4,9,2026-02-17 11:13:02,180,14
飞驰人生3,1,在《极速风流》、《极速车王》、《F1：狂飙飞车》之后，国内也拥有了自己相对成熟的赛车大片。相较前两部，本部文戏聚焦体制的选择使其讽刺性拉满，很多桥段都极具本土特色和集体回忆。智驾与车手之间的抗衡与协同进步；车企数据保密与远程遥控的风险边界；从运动员造神到失败网暴，仿佛在为刘翔奥运时遇到的舆论发声；会议室与休息室里的完赛，是随处可见的现实缩影，但好在内燃机的轰鸣与车轮扭转的急速是人性之外的东西，是澎湃的荷尔蒙，是死神在耳畔的低语，是只有前方的孤勇，韩寒给他热爱的赛车运动献上了最美的一封情书。现在回过头看看方舟子当年对韩寒代写的质疑，韩寒的一生都是对此最有力的回击。,5,1,2026-02-26 10:43:54,284,14
飞驰人生3,1,肾上腺素拉爆，全程刺激，三百多的速度开出了六百的感觉,5,1,2026-02-18 14:37:41,26,14
飞驰人生3,1,黄景瑜已经可以考究演技了,5,3,2026-02-17 13:32:26,12,14
飞驰人生3,1,很好  虽然依旧是小人物的被欺负背叛到不屈服  用实力赢得尊重  里面的团队情义  对手帮衬  赛车场面都很让人动容,4,4,2026-02-17 19:33:20,58,14
飞驰人生3,1,挺标准的商业爆米花电影啊，除了中间有些台词场面略中二，其他都还ok的。btw觉得电影的英文名没见过就查了下，还真是个知识点呢——Pegasus是希腊神话中的一匹有翅膀的飞马，象征着自由和灵感。现在也常用来指代一些高科技或航空相关的项目，比如卫星或无人机,4,2,2026-02-21 07:51:53,126,14
飞驰人生3,1,感谢hh 厌女没有多余情节。突然明白了极限运动的点在哪。 可能直男如我 看了太多他的书 完全能get他的好笑。 出去转转啊,5,2,2026-03-02 21:09:31,61,14
飞驰人生3,1,连续三部都不落水准。难得！,4,1,2026-02-18 13:51:44,13,15
飞驰人生3,1,2026.2.18 未来时代影城 可以看，但是节奏都一样，部分镜头很燃，也带上了讽刺。但是还是在套路范围内。,4,0,2026-02-19 10:30:40,54,15
飞驰人生3,1,車能不能不要每次都壞呢？,4,1,2026-02-18 17:36:49,12,15
飞驰人生3,1,支持飞驰系列！！永远支持韩寒！！！！再多拍点电影吧！！！好看！！！！！爱看！！！！！,4,8,2026-02-22 20:48:20,42,15
飞驰人生3,1,飞驰一二之后，来看三还能翻出什么花？影片一开场就是各种欢乐名场面轮番上阵，开出租的、开老头乐的、开专车的，还有局里局气的风洞测试，笑点密集又接地气，好几次忍不住笑出了声，观影氛围简直不要太好！魏翔的松弛感carry全场！而到真正的赛车环节，韩寒总能甩出王炸，用实拍把那种生死时速的沉浸感做到极致。“这开的已经不是路书了，是一封情书”，破破烂烂的铠甲穿越到这无限内卷的时代，飞沙走石戈壁划成一道黄金体验，太燃了啊，这个赛道的最强王者。人生不是百米冲刺，而是漫长的拉力赛，惟独行者，道路宽广。,5,6,2026-02-17 19:27:42,244,15
飞驰人生3,1,跟第二部的节奏差不多，被忽悠之后生气，手搓赛车比赛。,5,2,2026-02-21 22:06:59,26,15
飞驰人生3,1,系列最佳，这部戏最精华的地方从来不在赛车场上的武戏上，而在文戏的设计。中年男人手握二百五十万计划躺平，为梦想奔赴却遭奸商算计，砸锅卖铁最终回到原点。,4,0,2026-02-20 16:09:48,74,15
飞驰人生3,1,这次的笑点还是很“飞驰”——开专车的叶经理、分口袋装纸的林臻东、“中国足球没看吗”等等，都是冷不丁幽你一默，不是硬挠你痒，春节档唯一一部好看的。,4,9,2026-02-17 13:07:31,72,15
飞驰人生3,1,"比预料之中的还要好看
张驰的驰，马也，迎到了马年
赛场不在会议室，风洞和球局对峙也耐人寻味
柏油路&砂石路两种风格赛道，画面精彩绝伦，极限挑战肾上腺素狂飙，心跳加速，紧张的不的了。
秘密武器换胎切位苦练
演员和台词都很燃！叶经理关键印象深刻
在期待下一部了",5,7,2026-02-17 16:15:27,128,15
飞驰人生3,1,感觉就是前二部的翻拍，基本剧情简直一模一样，简而言之就是个人车手因为各种原因重返赛场拿冠军的故事。赛车部分对拉力赛外行来说就是看个热闹，本作为了给腾哥上难度甚至加入了夸张的盲开设定。结尾部分的处理并没有前两部那么的诗意和浪漫，流于一般。还好有沈腾，搞笑还在，过年期间热热闹闹快乐热血一回，还是可以值回票价的。,4,3,2026-02-17 22:38:47,154,15
飞驰人生3,1,比赛，就他妈不该在会议室里被领导们完成。,5,1,2026-02-18 18:27:05,20,15
飞驰人生3,1,依然很佩服韩寒，在中国电影环境中把一个陌生而单一的赛道拍出点东西来。,4,0,2026-02-24 16:28:01,34,15
飞驰人生3,1,韩寒和张驰一样，越来越成熟了，这种成熟是终于懂得在规则之内玩转规则，但同时又保持着自己的风格和坚持。这是一部真正的赛车电影，跟1、2不一样，不再靠沈腾的个人喜剧形象加持，而是认真地把重心放在赛车场上。大量的赛车戏份相当考验功力，超出预期的紧张刺激。,4,0,2026-03-25 18:55:37,124,15
