movie_name,comment_type,comment_text,rating,votes_count,created_at,comment_length,source_page
飞驰人生3,0,不像第一部工业攒装，但也没有第二部精致充实。赛车戏依然是好看的，但就是开始和结束得都仓促，有点意兴阑珊。,3,0,2026-02-26 01:08:44,52,20
飞驰人生3,0,不是所有的赛车比赛都发生在会议室。理想主义最后的倔强与坚守。,3,1,2026-02-17 22:21:51,30,20
飞驰人生3,0,拍到第三部，强如本命赛车手的韩寒，也终究难以走出舒适圈。沈腾尹正的组合仍然奏效，比赛场面也依然热血沸腾，但这些真的让本片足够精彩吗，毕竟每个桥段每个爽点每个转折前两部都有过。本片真正的亮点在于反体制的内容，能把那些规则背后的弯弯绕在这个层面稍微批判一下，已经算是了不得的事，但很可惜，这部分也只是惊鸿一瞥般被埋没在后半段的赛车戏中。如果有第四部的话……也许我们不需要再打一次中年鸡血了。,3,1,2026-02-22 19:44:04,193,20
飞驰人生3,0,第三部来说，不错了，故事片，模式一样有点老套,3,0,2026-02-24 23:40:12,22,20
飞驰人生3,0,韩寒已经具备商业片导演的素质，现在可以开启下一个系列了,3,0,2026-02-18 00:40:14,27,20
飞驰人生3,0,前面的文戏真的超烂啊，不然可以4星，真的超烂，拍得烂，演得也烂，似乎很敷衍，剪得更烂，太低水准了，突然冒出的打乒乓这种讽刺老梗太生硬了啊，然后又再来一遍台球，假正经、也不搞笑，合着第三部的剧本就60分钟到赛车戏，其他都是凑时长来的吧。赛车戏是好看，难度系数大增，两条线路，轮胎隐患、引擎盖问题，都是前两部的再升级障碍，随着油门离合声、刹车声、发动机声、摩擦声，一步步开向高潮！,3,0,2026-02-25 22:20:32,188,20
飞驰人生3,0,还行吧，故事有点简单了。飙车戏倒是又爽量又大。,3,0,2026-02-20 15:58:45,23,20
飞驰人生3,0,真想不到第四部怎么拍，如果还是换汤不换药，就真没劲了,3,0,2026-02-25 19:32:10,26,20
飞驰人生3,0,去年f1横扫全球的时候，还时常有些不平之声，说“飞驰人生2不比这强？”。现在韩寒拿出飞驰3，终于向所有人证明了：飞驰人生真的不如f1！,3,0,2026-02-20 12:57:25,67,20
飞驰人生3,0,基本舍弃了F1式标准商业片格式，或者说把三幕式的转折都给了一场比赛本身。放在春节档可能是聪明的做法，但手握沈腾和IP两大核武器，拍的这么简陋和保守，比较失望。,3,1,2026-02-17 17:16:11,79,20
飞驰人生3,0,5.4,3,0,2026-02-22 19:37:10,3,20
飞驰人生3,0,中国影视作品终于有了自己的头文字D/速度与激情，三星半,3,0,2026-02-19 13:24:44,27,20
飞驰人生3,0,还是前两部的叙事套路，中间还是一堆的尴尬生硬情节，真就是靠矮子里拔高个,3,14,2026-02-19 11:54:40,35,20
飞驰人生3,-1,F1和飞驰人生3的区别就像是早期ios和早期安卓的区别……,2,3855,2026-02-17 11:33:11,29,1
飞驰人生3,-1,两个小时的片长，最后一个小时在拍一场比赛，重复的镜头，重复的对话，重复的剧情走向，重复的结果，离谱剧情，低质鸡汤，劣质鸡血。导演确实很爱赛车，但完全不懂电影。,1,2921,2026-02-17 11:19:24,79,1
飞驰人生3,-1,"天梯公司花大钱搞芯片，号称能取代领航员，结果决赛里张弛那辆破车连发动机盖都飞了，全靠肉眼盲开、手动换胎，最后硬是赢了人家最先进的科技。那这芯片到底有啥用？
第一部的林臻东是让张弛仰望的巅峰，第三部却成了拿来衬托张弛的垫脚石。
编剧为了让林臻东说出“你跟在我后面”，直接让他赛前忘了把油加满。最后为了“帮帮张弛”，主动退出，扬土掩护。这哪是赛车手，简直是舍己为人的活菩萨，纯纯工具人。
张弛选拔赛才第三，半决赛只开了半米，转头自己掏钱参赛，立马化身车神。
轮胎不对？换！视线没了？盲开！车快散了？硬撑！
日韩顶尖车手全是背景板，只会玩阴的，最后被一个零件乱飞的古董车拿了冠军。
硬凹情怀，剧情靠巧合，赢比赛靠主角光环。科技干不过人肉，阴谋斗不过热血，看着热闹，细想全是硬伤。",2,1709,2026-02-17 22:08:30,336,1
飞驰人生3,-1,"都2026年了
还对全男阵容在大肆宣传
不敢想象
没有女性就这么值得骄傲吗？",1,1111,2026-02-17 18:59:29,38,1
飞驰人生3,-1,其实2就不咋好看了，不明白出3干嘛，沈腾你能不能专注喜剧电影……,1,1613,2026-02-17 11:33:43,32,1
飞驰人生3,-1,什么啊，看了一个半小时的赛车，自嗨？没情节，没深度，也不够热血，最后来个确实不容易，我看完电影也挺不容易,1,1206,2026-02-17 11:17:29,52,1
飞驰人生3,-1,越拍越魔幻，QQ飞车呀！,2,1174,2026-02-17 11:11:49,12,1
飞驰人生3,-1,5｜韩寒终于改了爱说金句的习惯，变得爱重复自己了。你告诉我这个系列除了背叛，逆袭，榨干车，兄弟情外还有一点新东西吗？除了赛道不一样，反派不一样外，其他模式框架几乎一样，一次奏效，两次还行，这一次连低谷都很凑数，人物弧光约等于榨干了，纯纯的透支 IP 狗尾续貂。还有所有电影都要加 ai 剧情吗，有 ai 剧情人类必赢啊，真的太没意思了。但国内拍赛车拍的好的真的太少了，这部片赛车部分不吹不黑还是算好的（即使最后烟花领奖和 f1 似曾相识。但前一个小时左右的煎熬尴尬段子劣质低谷，真的很难看。,2,818,2026-02-17 11:41:04,245,1
飞驰人生3,-1,太无聊了，要睡着了,1,1013,2026-02-17 11:15:13,9,1
飞驰人生3,-1,全程就是一帮男的在自燃，不知道燃些什么,1,540,2026-02-20 17:13:39,19,1
飞驰人生3,-1,不亚于维斯塔潘在车里喊了声小爱小爱,2,330,2026-02-19 16:45:32,17,1
飞驰人生3,-1,除了赛车片段之外完全是史。沈腾用赛车顶在黄景瑜车后的瞬间，韩寒的南通刚交幻想完成了实现。看到一个博主很精准的概括，韩寒并非不喜欢《小时代》，而是不喜欢女人演的小时代,1,331,2026-02-19 22:57:02,82,1
飞驰人生3,-1,这能有7.6？？？一模一样的剧情套路 毫无笑点,2,480,2026-02-18 13:12:18,23,1
飞驰人生3,-1,给我看困了，还是烂尾了啊,2,751,2026-02-17 11:11:42,12,1
飞驰人生3,-1,去年看了皮特的F1后再看此类国产片真是索然无味啊,1,578,2026-02-17 13:04:53,24,1
飞驰人生3,-1,男人还是太好赚钱了，和飞驰人生2一样的故事重拍一遍，也能在春节档圈钱一波。,2,264,2026-02-21 11:19:09,37,1
飞驰人生3,-1,F1之后真给他学到了，类型技巧全面升级对标。个人战胜资本，手工战胜AI，中国战胜日韩，韩寒试图把每一种爽感往上叠加，就连沈腾都要朝着不辣的皮特照猫画虎。当一群男人围着汽车残骸抱头哭泣的时候，哎，一场盛大的精神性交。,2,244,2026-02-17 16:15:13,107,1
飞驰人生3,-1,这同样的剧情可以一口气拍到《飞驰人生100》啊,2,178,2026-02-23 17:52:33,23,1
飞驰人生3,-1,傻子片 莫名其妙不知道燃什么,2,220,2026-02-21 14:09:32,14,1
飞驰人生3,-1,看样子是还要出续集吗？永远都是不看好的车队-开场优势-车坏-拼命-微弱优势（不）夺冠，以及意味不明的笑点，这种剧情看一次还好，一直这样，拍的有什么意义吗？,2,337,2026-02-17 13:34:39,77,1
飞驰人生3,-1,睡很好 衔接转场毫无逻辑 不知道在燃些什么 没见过这么胖的赛车手 减肥药都出来了不知道吃点吗,2,168,2026-02-18 19:11:50,46,2
飞驰人生3,-1,观影过程中玩手机玩到知道冬奥得了两块金牌。主要是沈腾和尹正那个体脂率说是赛车手实在说服不了我，看看去年的皮特，对比太强烈了,2,153,2026-02-19 09:13:29,61,2
飞驰人生3,-1,好难看啊......比前两部难看太多了，也完全比不过剧版的前一半。四辆车同时爆涡轮，张驰还在自己揽责，还真有粉丝觉得是他的问题，就很荒谬，韩寒你是在把观众当傻子耍吗？你要是真不想写文戏了，你其实可以不写，也好过写成这么如坐针毡如芒在背如鲠在喉的鬼样子。对女角色就知道不会写干脆不写，对文戏就不知道不会写就别写出来膈应人吗？,2,75,2026-02-28 03:26:30,161,2
飞驰人生3,-1,全男阵容，中年登味，非常没意思。没有笑点，也没有情节。前情提要也不需要那么长。非常无聊。,1,384,2026-02-20 10:13:22,44,2
飞驰人生3,-1,不会写剧情就别写，拍一段赛车比赛视频放b站得了,2,108,2026-02-23 23:40:25,23,2
飞驰人生3,-1,看前半段以为要斗反派搞一波群像，结果看后半段又回老套路了，一个模板能拍二十部。。。审美疲劳了,2,232,2026-02-17 21:33:10,46,2
飞驰人生3,-1,主题是人定胜AI，但韩寒写的段子比人工智能写的段子还尬，赛车段落也没爽起来，这种水准的电影差不多真的可以用seedance 2.0取代了,2,143,2026-02-17 12:20:36,68,2
飞驰人生3,-1,还没怎么样呢 先排女起来了,1,368,2026-02-17 14:29:11,13,2
飞驰人生3,-1,国内中年男演员能不能注重一下形象管理，沈腾这个体格塞得进赛车吗？赚钱也顾点脸面吧,2,87,2026-02-25 15:49:47,40,2
飞驰人生3,-1,韩寒现在的电影纯粹得要命，里面只讲三件事，兄弟、赛车、潜规则，连成句就是，有了兄弟的托举哪怕被潜规则也要坚持赛车。此处兄弟一词基本等同于速激里的family，国内院线最早的同性伴侣形象，俨然由韩寒首创。,2,58,2026-02-27 23:11:36,101,2
飞驰人生3,-1,4.6/10，依然是近几年春节档唯一的全片一个女性角色都没有钉子户，电影主要还是韩寒擅长的领域加上类型片结构支撑，但是每一部都用同样的结构复制就没啥意思了，一部通俗的娱乐片，鸡肋干电影，食之硌牙，弃之不可惜。,2,29,2026-02-22 23:15:34,104,2
飞驰人生3,-1,对2来说简直是狗尾续貂。,1,173,2026-02-17 16:35:30,12,2
飞驰人生3,-1,2.5，完全沦为“为了一碟醋包了一盘饺子”的典型代表。还是以往熟悉的失意中年男人完成人生逆袭的公式套路，但也未曾想这次装都懒得装了，开篇就直截了当的告诉我们，这次就是为了蹭春节档的热度，然后将我们一切非常熟悉的人生低谷油门焊死兄弟背叛套路一股脑塞进去，后半段再放一段还算看得过去的赛车戏码，最终逆袭成功。因此结果也可想而知高不成低不就，甚至看不到韩寒曾经还说得过去的文艺青年精气神特色（姑且算特色），陷入了彷似一个老人不断的高谈阔论自己辉煌往事的桎梏。,2,110,2026-02-17 16:09:15,226,2
飞驰人生3,-1,《飞驰人生3 : 加长炒冷饭版飞驰人生2》，资本大反派加点AI佐料，好耶又能圈一次！大差不差的故事翻来覆去嚼，真不腻味吗…,2,219,2026-02-17 17:17:28,61,2
飞驰人生3,-1,"让我们来看看一部拍摄仅仅4个月的垃圾是多么的答辩
制作流水，画面调色和涂抹感太重。
灯光脏兮兮。
登味严重，自我意识过剩。",2,104,2026-02-21 14:42:48,61,2
飞驰人生3,-1,故事悬浮难看，笑点浮夸尴尬，让外国选手使绊子，最后胜出的剧情够俗套的,1,427,2026-02-17 11:16:37,34,2
飞驰人生3,-1,太雄了！但是沈腾这张喜剧脸撑不起这种雄张力。当然这不是槽点。在英皇IMAX看了三遍《F1》后，就发现没有之前那么热血了，来来去去炒冷饭，凡事就怕对比。[万达CBD/¥42]（第一次大年初一看电影，乌央乌央的全是人。）,2,127,2026-02-17 15:24:26,108,2
飞驰人生3,-1,"3.0；反了反了，初一三部片感觉最不‘正常’的反而是韩寒这一部（是指其他片该好好该烂烂该平庸平庸），他还在舍不得他那些语言梗，特地为它们增加/设计/包装情节桥段‘水时长’，真是倒反天罡，但这更像是他为片子市场效益/大部分观众品味而作出的考量（满座观众都在笑，尽管我不知道他们最终评价如何），羡慕嫉妒恨他这个聪明人！只不过追求了金钱能否再有点艺术追求呢？
此外，除了语言梗、赛车术语以外的其他大量台词文本，都太像念官方公文…
后半段（三分二后？）的赛车追逐戏很好看，也有点不好看，燃也跌宕起伏，但时长持续过长却没有做出明显的松弛有道而造成我是出现观影失神/疲劳？（绝对不是连看的问题！🙋",2,4,2026-02-17 16:26:35,292,2
飞驰人生3,-1,张驰在第二部已经证明了自己，韩寒拍这部主要为了证明自己看过《F1:狂飙飞车》,2,21,2026-02-17 16:38:49,38,2
飞驰人生3,-1,毫无过渡，连前两部都不如啊,2,314,2026-02-17 11:27:58,13,2
飞驰人生3,-1,对现实清醒却无力，对规则灰暗面的不认同但理解，对现实的不甘心却接受，在意功利性的输赢并试图以梦想来粉饰。韩寒，你好歹曾是个以叛逆著称的作家。为什么要把1和2的犬儒再重讲一遍？,2,50,2026-02-19 10:07:25,87,3
飞驰人生3,-1,明明没新东西，还要拍到第三部。不是不好看，是太偷懒，原地踏步的续集，越拍越没新意。根本没有故事，文戏依旧是小品段子大荟萃，赛车戏只适合剪成片段在短视频刷一刷爽感，根本撑不起一部电影该有的质感与张力，中年韩寒摸到票房密码后，尽是生产一些流水线垃圾，少了当初《后会无期》时的真诚与锐气。,2,79,2026-02-18 19:47:09,141,3
飞驰人生3,-1,4分/如果影院直接放映《飞驰人生2》根本不会有人发现和3有什么区别，完全是模版似的复制粘贴，韩寒把中年loser拍得自成体系自成一派也算是功不可没，三部片子一味的前期筹钱后期打脸，知道了结局但依旧打鸡血，全程也只靠引擎的轰鸣声和震耳欲聋的背景音衬托气氛，也算是飞驰宇宙所有人物的大杂烩，我们中国有自己的复联4，自我感动的不知疲倦。,2,63,2026-02-19 16:48:03,165,3
飞驰人生3,-1,一个车手的意淫短片，毫无剧情,1,150,2026-02-23 15:51:13,14,3
飞驰人生3,-1,0个女演员啊，而且感觉部部一样,1,149,2026-02-18 06:17:14,15,3
飞驰人生3,-1,全男电影少半边天 怎配3星,2,102,2026-02-17 12:34:17,13,3
飞驰人生3,-1,里面的关系户车手说我不在乎别人说我是资源咖，只在乎我的实力是不是匹配资源……记得学生总说如果能给他们更多资源，他们就能拍出更好的东西，我总说先撒泡尿，现在尿可以省了……,1,9,2026-02-21 22:07:36,84,3
飞驰人生3,-1,"【3】就像那辆在沙漠中熄火的赛车，韩寒内心的少年感也就此湮灭，彻底沦为一名合格的产品经理。《飞驰人生3》的整体观感就是【安全】，不仅是为银幕外的观众提供足够的刺激，而且在剧作上完全使用爽文叙事，让每一位普通观众（尤其是一年只进一次影院的观众）从入座后就获得预料之内的鸡汤故事。不必有任何思考的负担，也不必有任何复杂的指向，“观众想要，观众得到；没有人物，只有符号”。本作的差劲甚至不是对第二部的自我重复（因为第二部还有一些团队精神的升华），而是创作者对市场的缴械投降
如果还有没看过的朋友，真心建议大家从后往前看：先看第三部的爽文叙事，再看第二部的团队精神，最后看第一部的死亡美学与反高潮消解，让张驰这个人物在死亡悲剧中完成自我价值升华",2,7,2026-02-18 16:16:44,318,3
飞驰人生3,-1,至少逻辑上是合格的商业爆米花片。但刻意的全男阵容真是shame，创作者的确是拥有这样的权力，但是刻意不出现一个女性对所有人来说都绝对不是好事。,2,30,2026-02-27 16:56:01,71,3
飞驰人生3,-1,这种东西能拍三部 在座的各位都有责任,1,70,2026-02-19 21:58:28,18,3
飞驰人生3,-1,和体制内领导相处的部分真实到令人生理不适。除了第三幕拉力赛（得益于竞赛本身的魅力）稍微能看之外，其余都很老套、很简陋、很粗糙，配乐和影像质感更是完全没有的。,2,40,2026-02-18 22:23:46,78,3
飞驰人生3,-1,虽然有闪瞎的奥迪赞助，但气质更接近奥拓（和《F1》《极速风流》放一块儿），除了个别镜头组的设计，倒确实见功夫。唱不完的光辉岁月，做不完的春梦，嘲笑完国足用国族上价值，成就了这场意料之中的男性“赢学”叙事。,2,9,2026-02-24 23:15:02,102,3
飞驰人生3,-1,全男班太离谱了味太冲了充斥着烟酒味不洗澡味,1,147,2026-02-19 09:16:28,21,3
飞驰人生3,-1,韩寒懂赛车，但不懂电影。如果我想看一个多小时的拉力赛，为什么不去看赛事转播呢？,1,164,2026-02-17 18:20:03,39,3
飞驰人生3,-1,【2.0+】如今韩寒也开始整自我重复的老一套了，都是再坠谷底然后逆袭改命，都是味同嚼蜡的燃与嗨路数，都是不堪入目的文戏笑料，不过那些刻意过火的算计情绪还算有所收敛，使得第三幕的观感是要略好于前作的，戏里国际赛场风光无限夺得冠军，戏外同期乱杀无人能敌稳坐票冠，或许这一次他真的要赢麻了……,2,2,2026-02-17 21:45:54,143,3
飞驰人生3,-1,能接受全男电影的存在，但无法接受刻意对女性进行系统性抹除并将其作为优点。“要么消失，要么被物化”难道是国产商业片处理女性角色的唯二路径吗？观众又非要选哪一坨更香吗？,1,47,2026-02-20 09:28:25,82,3
飞驰人生3,-1,"不是很理解作为一部较高成本的商业类型片剧作节奏出了这么大问题,整部影片120分钟第一幕至少占了70分钟,我一个没怎么看过电影的同学都觉得剧情发展突兀。不过可能我才是不懂什么是“商业电影”的,也许创作者也发现只要把后面的赛车戏拍好（再添些笑料）激发观众的情绪,观众自然不会在乎/计较影片前70％的问题。就像看av一样不在意前面的剧情而是直接跳到性爱场面。",2,61,2026-02-18 00:28:08,176,3
飞驰人生3,-1,也有点太难看了。一堆废戏加上对第二部的复制粘贴，不思进取到极致了。,2,31,2026-02-18 14:36:51,33,3
飞驰人生3,-1,依旧拜机械教男人余晖恐ai的意识形态，从这个角度上可以窥出保守立场。然而最大的问题还是在剧作上太散漫且粗制滥造了，非科班式的随性写作习惯一定在某种程度是种优势，然而此部中终究沦为抖机灵式的释放，阻碍了情感连续性的书写，使得整部片在情感节奏上完全业余，其实在前面两部中就存在这样的问题，只是在这一部中恶堕成了瑜不掩瑕。,2,4,2026-02-18 22:28:20,158,3
飞驰人生3,-1,"续作与前作唯一进步的地方就是采用对抗性更强的比赛方式，并升级了赛车戏的视听语言，因此观感上更有冲击力，但在其他方面烂得和前两部一脉相承。种种不合时宜的笑话还以为我在看春晚小品的重播，最后翻滚测试被撞毁的车，唱一唱歌回忆一下往昔峥嵘岁月，车自己就能装好自己。
不过最致命的是整个创作理念溢出屏幕的登味：现代赛车是一个高度现代化的运动，为了追求极致的速度，车辆和驾驶技术都必定会追求最极致的精细，指望“土法炼钢”“野生车手”能够击败有充裕资金的大车队，无异于希望背古人的棋谱就能去赢Alpha Go。这也是老登电影最大的特点之一，现实的制约别人的优势都是放屁，就是只要自己坐在驾驶室里，自己就永远是第一。",1,216,2026-02-17 11:19:46,300,3
飞驰人生3,-1,台词是AI的，也是机器人说出来的，幸好韩寒这次知道藏拙，也把上一部赚来的经费用的恰到好处。,2,1,2026-02-20 19:19:20,45,4
飞驰人生3,-1,"整体优缺点明显，后半段的赛车戏份还算爽，是全片唯一值得看且能看的部分，但模式和第二部差别不大。前半段文戏剧情平淡，整体结构套路化，显得拖沓。
演员表现上差距也很大。沙溢的台词生硬，断句奇怪，情绪完全不到位，没能撑住这个角色。尹正搞笑窝囊还算自然，但到结尾要帅的时候就开始刻意凹造型，显得很油腻，相比之下，张本煜魏翔的表演就舒服的多。",2,1,2026-02-19 18:00:26,166,4
飞驰人生3,-1,到底是谁在喜欢这个。。。居然还能拍三部。。。,1,62,2026-02-23 16:32:18,22,4
飞驰人生3,-1,又臭又长，味同嚼蜡。,1,145,2026-02-20 03:16:02,10,4
飞驰人生3,-1,【C－】从“为国争光”的草根逆袭表象入场，中段又一次因资本做局而抛出“全华班”“资源咖”“外卡中国队”“输给自己人我们就完蛋了”这种温和向的官僚主义讽刺。立意上确实因海量现实个例有着更为亲近的体感，但过于正剧向的文戏路线属于是自曝其短了，寡淡、粗疏且泛滥的口型不匹配反而证明了前两部的小品喜剧是该系列最重要的藏拙手段。顺理成章把核心资源投入到拉力赛奇观的呈现，力大砖飞的电影工业确实带来了赛车体量与小段落的巧思（分屏换胎），冲线部分终于有了实实在在的多车极速对抗，却始终无法制造出戏剧与竞技的朴素共振，在平淡乏味的胜利后，套路复用确实需要遵循“三而竭”的铁律。,2,8,2026-02-22 23:48:26,280,4
飞驰人生3,-1,我为什么要去看,2,19,2026-02-27 22:19:28,7,4
飞驰人生3,-1,一个写小说的，三部了叙事风格完全没有变化，并且逐渐带点儿战狼味儿了。,1,16,2026-02-24 21:24:00,34,4
飞驰人生3,-1,人生基本放飞，剧情基本放弃。被做局然后改车，套壳拍个没完是吧！？,1,28,2026-02-19 10:27:46,32,4
飞驰人生3,-1,"前边的群戏节奏很干巴巴的，配乐总感觉慢半拍，一群配角熟面孔很尴尬，配上干巴巴的台词和很硬的梗
黄不说话很帅很像赛车手
赛车部分是精彩的",2,6,2026-02-21 15:08:28,67,4
飞驰人生3,-1,"难看的一批，在电影院看的睡着了好几次，剧情不知道再燃什么，作为一部喜剧片，也完全不好笑，都是一些非常刻意的烂梗。。
信了豆瓣 7+的评分，个人最多给3 分",1,30,2026-02-24 16:25:13,77,4
飞驰人生3,-1,烂瓶装旧酒，别拍四了。,2,43,2026-02-20 18:41:00,11,4
飞驰人生3,-1,商业电影也娱乐功能都没有了。。。,2,14,2026-02-17 15:51:59,16,4
飞驰人生3,-1,故事比第二部差太远，完全不及格。好莱坞赛车片的视听效果比你好，人家该给观众的套路一点也不含糊，英雄之旅12步写编的有鼻子有眼，到你这里凑够了宣发的短视频素材然后干嚎两嗓子燃起来就算完工了，编剧也太糊弄了。,2,2,2026-03-06 20:28:17,102,4
飞驰人生3,-1,越来越难看的一个系列，一开场就是那个熟悉的登味儿，看第二部的时候虽然前一大半也很无聊，结尾赛车还能燃一下，这烂故事讲到第三次，看到最后也燃不起来了。铺垫部分实在是太敷衍了，这不是他们本来就可以参加的一个比赛吗？前面折腾半天只是为了加一个复仇的动机？可是这个动机带来的对抗一点都不热血，最后的获胜也没有说服力，剧作根本就不及格。韩寒抱着沈腾大腿，不断重复一个套路，真是找到了财富密码。,1,6,2026-02-27 14:07:55,191,4
飞驰人生3,-1,还是那个爱耍小聪明的韩寒，作品体裁与体量原因，“拼凑”迹象也更加明显。审美迭代变化为0，审美力普乏空泛。沈腾掐嗓音说话多少年了，顶级天赋造就顶级的生产资料，还挺得意洋洋，个人演艺轨迹越加AI化。尹正也算跟对人了，生产资料中的顶级配菜。魑魅魍魉，妖魔鬼怪。,2,1,2026-03-19 15:41:01,127,4
飞驰人生3,-1,@0090，1+2=3。,2,26,2026-02-17 19:59:37,12,4
飞驰人生3,-1,一点也没燃起来。,2,2,2026-03-01 18:13:04,8,4
飞驰人生3,-1,"老登的鸡汤。
三部曲的开头，经过，结果，全都是一个路子的大差不差，情节是个坐进影院就知道怎么收尾的故事。整个亚洲其他国家的顶尖赛车手全是npc，引擎盖这样了盲开拿冠军，这个内定能力比领导钦点还不可思议",2,20,2026-02-19 22:37:57,100,4
飞驰人生3,-1,不太清楚除了最后半小时，其他的戏份有什么意义。,2,34,2026-02-24 00:19:32,23,4
飞驰人生3,-1,唯一感到点新意的就是换轮胎的分屏镜头设计。其他就还是算了吧，故事方面不思进取，完全就是第二部的换皮；而在场面上并没有突破性的升级，影片后半截在我看来就是靠着音乐硬燃，关键这音乐也没啥感觉。另外影片中出现的黑科技让我闻到一股家人侠的气味。,2,2,2026-02-24 15:58:07,118,4
飞驰人生3,-1,一个套路能吃十年。,2,2,2026-03-01 18:13:55,9,5
飞驰人生3,-1,2.6 老中话术与身体极限,2,0,2026-02-21 17:59:53,13,5
飞驰人生3,-1,好难看 看之前我已经降低标准到好笑就行结果也完全不好笑。所有角色都扁平得像张纸 段奕宏的角色我本来以为会有些深度的没想到也是,2,59,2026-02-18 19:14:20,62,5
