movie_name,comment_type,comment_text,rating,votes_count,created_at,comment_length,source_page
飞驰人生3,0,张驰遭遇的不公平矛头指向从上一部的“资本”来到这一部的“半体制”，典型韩寒。要是春节档高级产品经理们拍亚洲大赛，主要矛盾必须是外围日韩，而不是在这内部。不会拍女性就继续不拍，第二部拍不好深度关系就改拍群像，全员工具化，归纳前两部的市场反馈“扬长避短”，全情拍他最爱的赛车，双线赛道、多车齐发、内外障碍、多视角拍个够，冲爽到底，干净夺冠，可以了，到头该完结了。,3,4,2026-02-17 18:55:37,179,5
飞驰人生3,0,双赛道的差异性设计还不错，赛车动作戏依旧强项，节奏掌控可以，但相比看文戏部分就弱得多，先低谷后夺冠的套路三部太一致，多个配角作用不大，主要配角的特点或转变也没能深挖。,3,2,2026-02-21 12:19:28,83,5
飞驰人生3,0,喜忧参半吧，沐尘100确实好看，双赛道多路况量大管饱，但剧情完全是对前两部模式的机械复刻，而且赶工痕迹明显：开头结尾塞前作混剪，段奕宏和张本煜有很多处台词口型对不上，不会还要继续复刻飞驰4吧？,3,7,2026-02-23 16:14:27,96,5
飞驰人生3,0,前盖打开太烂俗,3,11,2026-02-21 23:23:09,7,5
飞驰人生3,0,重复的剧作套路不说，连作为春节档喜剧的自觉都没有，韩寒去拍赛车纪录片可能更好一些。,3,10,2026-02-20 21:37:35,41,5
飞驰人生3,0,没啥太多期待，还是一样的拿安全换速度，然后拿下第一。看车还不错，剧情还是这样，一般般，只能说贺岁片就这样,3,8,2026-02-17 18:44:26,52,5
飞驰人生3,0,6.5分，再打高的话不知道该如何给去年皮特的F1评分了,3,9,2026-02-20 00:58:42,27,5
飞驰人生3,0,笑点真的都不好笑，这个系列老是只有半部好电影，不知道为什么,3,17,2026-02-21 10:43:30,29,5
飞驰人生3,0,一般,3,12,2026-02-17 15:30:57,2,5
飞驰人生3,0,"导演带着大伙看他自己的梦想成真，说实话实在共情不了，如果作为春节合家欢电影那没有问题。
Ps：2D电影怎么敢卖80多一张票的？？",3,10,2026-02-21 23:37:32,64,5
飞驰人生3,0,感谢蚂蚁阿福请客看片，虽然没有你们的贴片~,3,0,2026-03-02 17:02:33,21,5
飞驰人生3,0,典型热血爽片 从捡配件到上赛场的转折没太看明白 就挺突然的...所遭遇的困难精彩度有点不够支撑这么长的比赛时间 以至于中途瞌睡了几分钟,3,5,2026-02-17 15:04:01,67,5
飞驰人生3,0,节奏有问题，一直温温吞吞,3,0,2026-04-03 16:01:48,12,5
飞驰人生3,0,永远都是以凡人之躯对抗制度、规则和限制，故事有明显的割裂、拼接和遗漏，戏剧冲突和化解跳跃式呈现，整体不如前两作。,3,14,2026-02-17 11:30:41,56,5
飞驰人生3,0,文戏很一般（前半段，都有点想离场的冲动，毕竟是花了钱，最终还是忍住看完），后半段的赛车戏还不错，又把兴趣提了起来，而且量比前面二部都大。系列对比下来整体感觉第二部算最佳了。附：影院春节档排片和预售票房第一，上映第一天后豆瓣就敢开分（7.6分），有这样的评分加持下票房大概率是会超过第二部的33.61亿了，可能是春节档票房最高的一部了。,3,4,2026-02-18 01:41:25,167,5
飞驰人生3,0,与国际对标、向世界看齐的一部飞驰人生，经过前两部的叙事铺垫，走出了小人物奋斗和春节档喜剧电影的框架，但拿到了一个更模式化更流畅更类型的剧本，除了还剩一点中国式人情与喜剧元素，看不出飞驰人生的影子，换任何一个背景都是同质化的商业片。优点是影片更成熟，叙事更标准，节奏更沉稳，缺点却是个性化的，中国人在春节档需要的内容不多，进入高潮太草太早，整个高潮时间又太长。没再有自我牺牲的师徒传承，只剩戈壁夕阳下的英雄迟暮自我闭环，从剧情上说还可以有续作，从情感上说这就是大结局。,3,3,2026-02-18 09:53:36,233,5
飞驰人生3,0,拉力赛冠军再赢一个冠军。真是同样的剧情拍三遍啊：主角没钱了→比赛机会来了→参加比赛遇到各种阻碍→顺利发车→终点前出现意外状况→惊险夺冠,3,0,2026-03-15 22:41:02,67,5
飞驰人生3,0,倍耐力：差点以为你们要搞我  FIA：赛后调查再说算不算危险驾驶,3,0,2026-02-17 23:26:29,32,6
飞驰人生3,0,"没看过1,2部值四星
看过1,2的话三星",3,11,2026-02-18 13:18:18,20,6
飞驰人生3,0,用AI生成剧本的方式拍摄人类战胜AI的故事,3,0,2026-02-23 21:39:29,21,6
飞驰人生3,0,"依旧直白，依旧热血，适合春节档放松。开场Queen的Don't Stop Me Now有点燃。“这不是路书，这是情书啊。”魏翔贡献了不少笑点。
Call Back了这对弛强组合最初相遇的故事。
赛车关键在人还是车？辅助驾驶系统被引入，反而让车手不敢相信自己的判断，而任何精密的AI计算在极限的环境中还是需要人这个变量。普通人也能赢的故事，还是愿意看。",3,0,2026-02-17 16:30:36,175,6
飞驰人生3,0,制作水平不错，紧张感也做足了，但是可惜去年刚刚有一部同题材的天花板《F1》，这部对比之下就不太行了,3,0,2026-02-21 02:23:45,49,6
飞驰人生3,0,百强总呢，怎么最后不提下他？结局太仓促了，驰子，你赢了。结果还真赢了...把外国车队去掉，改名飞驰人生3内战，绝对可以。,3,0,2026-02-26 12:37:07,60,6
飞驰人生3,0,作为春节档电影而言算是及格了，笑点与叙事并存，至少整个故事还是讲述得比较流畅。电影最大的问题还是在于故事太过套路，先抑后扬的节奏加上一些意料之中的意外，三部叙事上太过同质化。,3,2,2026-02-19 22:54:02,87,6
飞驰人生3,0,看看人家F1用的是啥样的大叔，再看这个。。。沈腾应该做的是深耕喜剧，现在这个形象和角色完全不适配，作为观众我没办法入戏，直接看睡着了,3,18,2026-02-23 20:31:56,66,6
飞驰人生3,0,三部里面文戏最多的一部，同时也是飙车时长最多的一部，比较俗套的设定，但是后面四十多分钟是真的爽，爽到结尾，比f1还要爽。,3,0,2026-02-18 21:07:45,60,6
飞驰人生3,0,对我来说有点ai感的剧本和台词……再就是没有连续系列观影经验的我比较难以带入故事，优点是赛车比赛部分后半段是做的不错的。,3,0,2026-02-28 22:31:46,60,6
飞驰人生3,0,前面的文戏怎么能拍得这么无聊，我带我妈去看的，尬得我只能不停和她解释里面无聊的梗，无奈她还是睡着了。不写文字了所以文戏也拍不好了吗……还有沈腾的关系户们，真的，我喜欢看你们一起拍综艺不代表我爱看你们一起尬戏。,3,11,2026-02-20 00:32:09,104,6
飞驰人生3,0,6.4分。韩寒要是不会拍文戏可以不拍，前边10分钟介绍背景，中间40分钟跑个半决赛，再10分钟过渡一下，最后一个小时拍决赛，这个节奏我感觉就挺好,3,6,2026-02-17 17:59:22,72,6
飞驰人生3,0,反而系列里最普通，核心梗是换轮胎，问题是换轮胎这场戏不管是表演还是剪辑，都很不利索,3,22,2026-02-28 21:48:19,41,6
飞驰人生3,0,"不是所有的比赛都是会议室里完成的，Pegasus 3, 全智能热血拉力。高难度拍摄，必须认可。剧情上新瓶旧酒，有点重复，喜剧料不足。评：3.7星",3,0,2026-02-19 20:18:40,72,6
飞驰人生3,0,前面的戏太长，又很无聊。后面赛车的戏份还不错,3,0,2026-02-19 15:37:09,22,6
飞驰人生3,0,这一系列能拍到第三部 确实也没啥拍的了,3,4,2026-02-18 13:50:51,19,6
飞驰人生3,0,5，比较好的地方在于把前两部那些尴尬的喜剧桥段基本都去掉了，可以说是一部比较纯粹的赛车片，不过跟《F1》那种强调个体自我存在的超越不同，外部强权对赛车运动的控制和压迫一直是这个系列的主要冲突来源，这部肯定是又强化了赛车戏的强度，但离《F1》的沉浸体验还是有不小距离。赛车戏其实也没有拍的非常讲究，它这个赛事设计得非常奇怪，拉力赛是很难最后集体冲线，还是有点糊弄小白的意思。韩寒现在算是彻底躺在自己的舒适区里面不出去了，拍的确实很保守，后续发展就看还能不能继续这么圈到钱了，这个系列下一部肯定还有。,3,2,2026-03-03 20:46:25,248,6
飞驰人生3,0,《永远不回头》，是高四复读时mp3中经常听的张雨生的一首歌，已经过去好久好久好久。,3,0,2026-03-02 16:24:34,41,6
飞驰人生3,0,玩着手机看完的,3,5,2026-02-22 16:29:45,7,6
飞驰人生3,0,韩寒这次真的拍爽了吧。,3,2,2026-02-18 10:24:41,11,6
飞驰人生3,0,叙事比起第二部烂太多了，感觉一半都在拍MV，剧情上中年焦虑技术焦虑未免太强…………？看的时候有点怀疑人生，我大年初一来电影就看这个？？不过大银幕看到车还是挺爽的。,3,5,2026-02-17 14:00:30,81,7
飞驰人生3,0,3.4分。,3,0,2026-02-23 00:03:30,5,7
飞驰人生3,0,以后再有4的话感觉可以晚1小时进场尤其是看完拯救计划之后再看……这文戏简直惨不忍睹都不能说是偷懒只能说膨胀了过于自信怎么可以比上一部还差……尤其是DP以前不是还干剪辑吗也不救一下导演……难道是因为剪辑师太差给剪废的（所以车戏部分换了个剪辑？）说到车戏那又是毫无疑问的五星水准……跟F1比当然是不能比但依然是属于世界范围的第一梯队,3,0,2026-04-08 12:23:54,164,7
飞驰人生3,0,"深影国际影城(学院南路店CGS中国巨幕店)  02-17
17:45~19:50
4号厅  M19",3,1,2026-02-20 04:28:48,49,7
飞驰人生3,0,确实很有爽感……但是俺真的觉得综合来看很一般完全不如前两部不。,3,3,2026-02-23 19:49:00,31,7
飞驰人生3,0,万达崇明,3,0,2026-02-23 14:38:15,4,7
飞驰人生3,0,“聪明”又无聊啊，换胎一幕还比较燃。没有沈腾就毫无看点了。,3,0,2026-02-19 16:24:17,29,7
飞驰人生3,0,新梦Cinity  赛车环节还是挺专业，但已经审美疲劳了，其他部分也乏善可陈啊。,3,0,2026-02-27 15:57:18,40,7
飞驰人生3,0,好肥胖的赛车手,3,13,2026-02-18 00:26:16,7,7
飞驰人生3,0,坏了，真让韩寒学到了。不同于F1，走的是类似极速车王的路子。可惜F1还能说是隔了很久有新鲜感，同一个系列三遍讲同一个东西已经是腻了,3,0,2026-03-08 18:17:20,65,7
飞驰人生3,0,"IMAX 大銀幕，後40分鐘賽車場面的視聽觀感不錯，自然地景壯闊，整體節奏鬆緊有致，每3-5分鐘一個情節點，複雜路況和各隊戰術，通過耳麥和團隊對話，高效交代龐雜和專業的資訊。
但前半部分拖沓且刻板，反派大多為外國人或體制內，堆疊矛盾，高額預算與理想難以兼得…但因有團隊齊心協力，傳統賽車手感+高新技術，換輪胎細節(隱喻)貫穿全片，兼顧現有AI的賦能和侷限。
故事緊扣專業~夢想~堅持~團隊~熱血…基本都能打到12-60歲左右的大眾群體的共鳴。
《飛馳人生》三部曲已然形成華語賽車電影 IP、工業化產製流程與規模，相比周杰倫監製的《叱咤風雲》或只拍得起一小段大場面的《我和我的賽車老爸》(知名編劇寫本，但情感也呈現得稀爛)，港/台賽車片若不與非本土資本或用大量虛擬棚拍和 Ai 畫面，近年基本望塵莫及。",3,3,2026-02-17 17:28:54,350,7
飞驰人生3,0,文戏的视听语言以及文本上，细节的瑕疵还是不少，尤其是还学了抖音短视频转场的一些“脏东西”，但好就好在赛车戏量大管饱，整体体验还不错。,3,1,2026-03-07 15:52:54,66,7
飞驰人生3,0,平淡如水…为赛车赛加一星吧…看完心中毫无波澜，理解不了为啥能火成这样…赛车题材本可以夯到爆炸。看看人家F1Brad Pitt吧,3,12,2026-02-27 22:10:30,63,7
飞驰人生3,0,赛车戏拍得不错。,3,1,2026-03-14 12:50:19,8,7
飞驰人生3,0,不难看的安卓赛车电影，笑点密度比前两部低，竞技场面毫无新意。,3,4,2026-02-18 18:33:38,30,7
飞驰人生3,0,一般般,3,0,2026-02-26 15:10:07,3,7
飞驰人生3,0,经历了飞驰1的叙事劫难，2的自省磨合升级后，韩寒完成了这条国内没有类型传统，国外有海量竞速场面佳作支撑的银幕赛道突围。,3,3,2026-02-21 20:52:06,59,7
飞驰人生3,0,享受比赛,3,1,2026-02-22 15:07:10,4,7
飞驰人生3,0,赶紧结束这个系列吧。,3,0,2026-02-25 10:19:04,10,7
飞驰人生3,0,韩寒已经放弃叙事和人物塑造了，这基本上就是一部点缀了段子和幻想情节的汽车拉力赛纪录片。没有赛车的段落，比如开头和结尾，要多尬有多尬。,3,5,2026-02-17 22:00:40,66,7
飞驰人生3,0,"之前對這個系列一點興趣都沒有，但覺得能拍到第3部還能艷壓春節檔其它電影應該還是有點東西的吧，結果真的有驚喜，完全在預期之上
首先印象深刻的是場面調度，流暢自然又大氣，賽車戲拍得確實很燃，比《F1：狂飆飛車》還好（可能因為有風景加持？），不愧是專業賽車手出身，把賽車的技術和藝術都呈現了出來
其次特效、剪輯、節奏都不錯，全程無尿點、不齣戲，不得不承認韓寒的導演轉型很成功啊……
最後，很意外片中那麼多明示贊助商暗箱操作國家隊名額、拉踩中國足球的橋段，感覺審查制度也沒有很嚴格嘛！XD
PS.在補完了1和2後覺得3確實是最好的，很明顯每部在各方面（故事、特效、場面調度等）都有進步，真是未來可期啊！！！",3,1,2026-02-25 01:00:45,299,8
飞驰人生3,0,不如前两部，结局太仓促，所有都在预想范围内,3,4,2026-02-22 15:45:35,21,8
飞驰人生3,0,没想到有一天看韩寒的片子也会有“这镜头是怎么拍出来”的感叹。作为商业片无疑是合格的，韩寒算是混成型了，把系列片做成了展示电影工业实力的容器，不过真不知道离开他熟悉的赛车领域与“男性成熟”还能拍出什么来。严格来说这不是一部运动类型的电影，而是奇观片，赛车戏对于观众而言相当于怪兽片里的怪兽，韩寒很懂观众们爱看什么，所以用一半的时间来呈现最后的决赛（甚至没有时间给半决赛），但是在压缩的过程中也把这项运动的专业与精神压缩掉了，取而代之的是一种模块化（在公式化以外）的剧情。如果说好莱坞经典类型片是大厨做的味型菜，《飞驰》系列只能算预制菜了，问题是观众现在去影院能吃上这种已经暗自庆幸了。,3,11,2026-02-18 20:58:46,291,8
飞驰人生3,0,飞马也人生，Pegasus帕加索斯，大银幕，中年人，还是适配的。公平，正义，胜利，这种简单的故事确实很普适，值得借鉴的创作思路。,3,1,2026-02-18 02:57:33,64,8
飞驰人生3,0,"公平人生3！
独立车队对抗大厂车队，贫穷实力老派车手对抗依赖新技术的新生代车手，韩寒揪心的牢骚和漫长的中国拉力古典赛车梦，也是世界的古典赛车梦。
韩寒把他以前在现实中失去的东西，在一定程度上用电影弥补了回来。插科打诨，拖拉1小时才进入正题，量大管饱的赛车戏，拍得挺好，就是配乐太吵太煽情。虽然不够硬核，但可能是票房最大化的选择了。
我以为结局会是因为撞烂的保险杠凸起了让车身变长一点点点点点点，所以赢得冠军呢！这个结局不太寒啊！最后的尾流，是致敬传奇保胎佩大师为潘子硬生生挡了汉密顿8秒还给他拉了一个尾流后助潘子拿下人生首总冠的神迹...吧？多带两个轮胎不会增加油耗和轮胎损耗吗？有周冠宇和九冠王勒布，好大的排面！",3,0,2026-03-20 19:09:13,307,8
飞驰人生3,0,不管多急，都要系好安全带再冲进赛场，这很帅！,3,0,2026-02-18 00:22:29,22,8
飞驰人生3,0,三星半《飞驰人生3》已阅。不仅是赛事难度增加，张驰有点像《圣斗士星矢》里的星矢，我可以被打败，但是小宇宙会燃烧到极点，延续2中对于世态的那种对社会的穿透性的观察，顺便解决了困扰大家很多年的疑惑，为什么中国三大球搞不上去。让我想到李世石和阿尔法狗对战时的那种状态，适合春节档观看。,3,0,2026-02-18 10:46:49,139,8
飞驰人生3,0,比第一第二部略差,3,33,2026-02-17 12:22:36,8,8
飞驰人生3,0,"7.1分，虽然赛车戏多了不少，但整体观感终究没有超过第二部，以至于显得有些疲软。当然在电影院看得还是带劲的，只是如果第四部还是这种套路，我就没必要去电影院看了。
对我而言是第二部>第三部>第一部，第一部始终没有看完。",3,1,2026-02-23 17:46:40,108,8
飞驰人生3,0,旧瓶旧酒，赛车戏挺燃，冯绍峰从第二部出现，到现在第三部，为啥能和张弛自如对话？我很疑惑…而且一开始有个儿子张飞，戏剧空间很大，结果硬生生下线…编剧还是笔力不足，从文章开始，形式大于内容的糟粕一直存在…可惜,3,0,2026-02-20 00:21:16,102,8
飞驰人生3,0,即使过了许多年，张驰依旧倒霉，依旧窝囊，依旧在权力的游戏里倍受凌辱。依旧以一个显眼包的姿态，开着一辆破铜烂铁，然后以一腔孤勇，所向披靡，驰骋疆场。,3,0,2026-02-21 21:08:56,73,8
飞驰人生3,0,没给那几个年轻帅哥发挥机会~,3,0,2026-02-18 23:52:31,14,8
飞驰人生3,0,叙事结构过于类似前作，没有任何新意。虽然工艺上成熟度比较高，但笑点不如上一部（当年被老头乐逗笑了）本作出彩的地方是新的赛制和赛场的设定，比一般常规拉力赛的间隔发车和单一赛场景观更有看点。本质上和F1一样，属于赛车电影向赛车游戏学习的产物（跟地平线系列似的）。期待看到更多国产车的期望也没有达到。但依然可以靠喜爱驾驶的热情带动一大批观众（包括我）希望推陈出新吧，别翻来覆去了（但或许也是赛车游戏的难题？）,3,0,2026-03-01 16:07:57,201,8
飞驰人生3,0,中间换轮胎是比赛的亮点，最后冲刺少了点高潮。永不回头。,3,0,2026-02-20 23:04:23,27,8
飞驰人生3,0,看完后我确定了我确实不喜欢这个系列，真的无感。整体感觉很无聊，韩寒的剧作也太偷懒了，每一部都是有人背后搞张驰让他背黑锅，制造戏剧冲突，也不能一个被害后复仇的套路用三部啊！但是我没想到这部国家队当反派，最后还只是亚军，这有点大胆了。而且本片也不算喜剧，就前半段有几处小笑点而已，后面大部分都是纯正剧，纯运动题材。可能是我个人原因，最后大结局我也没燃到，而且是三部中的赛车戏我都没燃到。这是我个人问题，因为我一直不爱看赛车片，好莱坞的也不喜欢。剧本极其的简单，压缩所有文戏，押宝赛车戏。这次韩寒请了好多明星，但大部分都是露一脸的客串，白宇帆好像连台词都没有，就打了个广告。我想知道沙溢咋回事，也不是第一次演反派了，这次台词怎么这么差？他一说话我就出戏！这可能是他职业生涯台词最差的一次。6分。,3,0,2026-02-23 23:03:51,344,8
飞驰人生3,0,"韩寒也就这样了，三部电影下来，套路还是那个套路，一直在重复自己，真的没啥可期待的了——这就是他的真实水平。没有逻辑没有热血，只有中年男登的自我感动，我是真的受够了。按理说5亿的制作成本不算低了吧？可呈现出来的效果却莫名廉价，这就很说不过去了。还是那句话，看过好的赛车电影，心里自然会有个坐标系。同题材的《极速冲刺》简直能把本片秒成渣渣，朗·霍华德拍的那才叫真正的""飞驰人生""。再说说配乐，这片堪称反面教材，完美论证了BGM对赛车电影有多重要，从头到尾没有一段能让人热血沸腾的音乐，干嚼馒头都快被噎死了。主题曲也土得掉渣，坐在影厅里听片尾曲，那种感觉就像大哥酒足饭饱后去KTV点了一首<朋友的酒>……对比一下《F1:赛道风云》的配乐，高下立判，简直是毁天灭地级别的差距.",3,1,2026-02-20 00:15:33,334,8
飞驰人生3,0,看到准备室里面有个人玩网球有点绷不住了，拉回到了f1。人斗机器的设定试了一下就浅尝辄止，略无趣。末尾赛车部分还是挺刺激的。,3,0,2026-03-01 00:28:49,61,8
飞驰人生3,0,打酱油的几位出现和下线都这么突兀吗，前一个小时像半梦半醒剪出来的，再敷衍点不如直接开两小时车呢。,3,14,2026-02-20 10:05:05,48,8
飞驰人生3,0,值得看。故事很完整，技术层面也严谨，情感表达比较到位，作为系列第三部，商业性更加成熟，但依然有“文青”的一丝温柔。,3,0,2026-02-25 21:59:17,57,8
飞驰人生3,0,《驯龙高手》≤≤《长安三万里》,3,0,2026-02-23 15:25:47,15,8
飞驰人生3,0,"前一个小时剧情套路无趣，看困了。
后一个小时赛车戏也就还行的水平，说不上特别好。
整体鸡肋之作。",3,2,2026-02-27 23:38:39,48,9
飞驰人生3,0,3..5 別整文戲挺對,3,0,2026-02-21 22:56:11,11,9
飞驰人生3,0,韩寒能写出很多段子和金句，但是这一集他走了一段专业的赛车的路。,3,0,2026-02-19 19:40:07,31,9
飞驰人生3,0,从第一部到第三部，面对无数不公，张驰终于站上了属于他的最高层次的领奖台。为他颁奖的是曾经的世界汽车拉力赛之王，这可能就是导演心中梦想的终章。,3,0,2026-03-30 13:28:32,70,9
飞驰人生3,0,完全就是复制粘贴啊！三部曲的剧情几乎一样，而且也不太能感受到爽点,3,9,2026-02-23 11:41:09,32,9
飞驰人生3,0,作为一个能立住的片子，不如2，情节人物镜头语言都很单薄，只有赛车镜头值回票价，但我还是不想继续要这样的商业片。,3,0,2026-03-16 00:44:20,55,9
飞驰人生3,0,尹正有点像张卫健了,3,0,2026-02-21 19:38:11,9,9
飞驰人生3,0,2.5 文戏无聊到喝了喜茶都犯困,3,0,2026-02-28 23:07:46,16,9
飞驰人生3,0,"沙溢这个角色的加入，算是韩寒在商业片外衣下，除赛车类型片的贡献外，个人最大胆的导演表达了。毫不掩饰的骂了国足，体育局等腐朽老一派的人和体制，竟然还给过了，就很魔幻，也许是李铁进去了，上面需要有给文艺松绑的迹象露出来吧。回到影片，整片建构很套路，你可以说他就是1,2的炒冷饭合集，但明显笑点和剧情推进毫无进步，甚至潦草退步，多数桥段冗长无力，几场选拔和比赛，都开始和结束的糊里糊涂，无段落感，看得出韩寒把宝全部压在最后几十分钟的追车戏上了，视觉冲击上确实有爽点，加上“中国队”这个名头，都有些赛车战狼的意味了。早预料到沈腾一定夺冠，便期待韩寒如何拍的讨巧服众，结果这部不靠什么技巧，也不末路狂花了，就是干踩冲线夺了冠，总觉少了一个最终爆发的燃点。",3,0,2026-03-20 15:42:53,322,9
飞驰人生3,0,2026.2.26于阿勒泰雪都影城,3,0,2026-02-26 14:39:39,17,9
飞驰人生3,0,文戏真不太行，虽然线条简单，但小戏很散。进入比赛阶段还算能看，提供了基本的娱乐性。,3,2,2026-02-20 19:27:19,41,9
飞驰人生3,0,前半程的一切都非常平庸，拉力赛开始之后步入正轨，在国内拍赛车戏这方面，飞驰还是遥遥领先的。,3,3,2026-02-17 13:26:23,45,9
飞驰人生3,0,太一般，音乐不够炸，反派形象太单薄，飙车场面不够刺激，非要整车前盖掀起那套让人看的憋屈，就不能来一场酣畅淋漓的比赛吗？最后反复搂肩也非常尴尬，展示兄弟情吗，就挺尴尬的，没必要感觉，结局戛然而止也不舒服。,3,5,2026-02-21 19:04:14,101,9
飞驰人生3,0,这样的电影会让人特别想念贾玲和她的热辣滚烫,3,3,2026-02-23 18:58:30,21,9
飞驰人生3,0,不乱上价值不多卖鸡汤老老实实拍自己最擅长也最专业的东西对韩寒来说已经赢了。,3,0,2026-02-18 19:43:01,37,9
飞驰人生3,0,文戏太拖沓 但是结尾收束感不错！,3,0,2026-02-20 21:05:10,16,9
飞驰人生3,0,第二部的情节虽然不复杂，但也胜在简明通顺，细节处理也比较熨帖，相比之下第三部前半程的文戏，明显就有点“硬写”，后半程的赛车戏漫长而纯粹，的确是一种酣畅的宣泄，我依然不会质疑韩寒对于赛车这件事的热忱和了解，三星半吧。另外最后的颁奖嘉宾好像是请来了勒布，有点牌面啊。。。,3,0,2026-03-08 22:54:26,133,9
飞驰人生3,0,把上一部嚼过的馍又嚼了一次,3,0,2026-03-07 20:29:58,13,9
飞驰人生3,0,辅助驾驶出的是说明书，尹正念的是情书💌只有赛车是舒适区，前面一个小时建议缩减到10分钟。,3,1,2026-03-01 14:17:52,44,9
飞驰人生3,0,挺杀时间的，一眨眼，两小时过去了。剧情简单，文戏弱，一直在飙车很刺激，但也有点吵，最后不出意料夺冠，更显得像是一场小孩子过家家的游戏。不过演员演技都不错。刷脸的帅哥挺多，但帅的时间太短了,3,0,2026-02-21 23:33:12,93,9
飞驰人生3,0,还是那样绝地求生反资本 套路复制不厌倦,3,0,2026-02-19 02:07:40,19,10
